source_id,source_url,path,geothermal_system,latitude,longitude,name,map_description,source,source_licence,attribution,parsed_at_utc
885,https://1000springs.org.nz/samplesite/885,/samplesite/885,Rotorua,-38.1619,176.2592,Whakarewarewa Feature 66,Another spring close to P1.0666. It's about 1.5 metres down a hollow and the spring also appears in the adjacent hollow. No outputs or vegetation.,manually saved 1000 Springs mapsearch page source,Creative Commons Attribution-NonCommercial-ShareAlike 4.0 International,"1000 Springs Project authors, GNS Science, and University of Waikato",2026-05-27T04:53:01.287496+00:00
886,https://1000springs.org.nz/samplesite/886,/samplesite/886,Rotorua,-38.1621,176.2594,Whakarewarewa Feature 67,Another spring situated in a hollow. No visible outputs or inputs. A couple of Manuka bushes exist on one side.,manually saved 1000 Springs mapsearch page source,Creative Commons Attribution-NonCommercial-ShareAlike 4.0 International,"1000 Springs Project authors, GNS Science, and University of Waikato",2026-05-27T04:53:01.287514+00:00
887,https://1000springs.org.nz/samplesite/887,/samplesite/887,Rotorua,-38.162,176.2593,Whakarewarewa Feature 68,"Immediately south of Feature 67, this spring is also in a hollow but has lots of brown sediment around it. No visible connections to surrounding springs.",manually saved 1000 Springs mapsearch page source,Creative Commons Attribution-NonCommercial-ShareAlike 4.0 International,"1000 Springs Project authors, GNS Science, and University of Waikato",2026-05-27T04:53:01.287535+00:00
888,https://1000springs.org.nz/samplesite/888,/samplesite/888,Rotorua,-38.162,176.2593,Whakarewarewa Feature 69,Aqua blue coloured pool with zero ebullition or outputs. A large dead log exists on one side.,manually saved 1000 Springs mapsearch page source,Creative Commons Attribution-NonCommercial-ShareAlike 4.0 International,"1000 Springs Project authors, GNS Science, and University of Waikato",2026-05-27T04:53:01.287551+00:00
889,https://1000springs.org.nz/samplesite/889,/samplesite/889,Rotorua,-38.162,176.2592,Whakarewarewa Feature 70,"Awesome hidden hot spring, only visible by a small hole. Dimensions are size of hole. Water is clear and no visible outputs. Doesn't get much sunlight.",manually saved 1000 Springs mapsearch page source,Creative Commons Attribution-NonCommercial-ShareAlike 4.0 International,"1000 Springs Project authors, GNS Science, and University of Waikato",2026-05-27T04:53:01.287575+00:00
890,https://1000springs.org.nz/samplesite/890,/samplesite/890,Rotorua,-38.1621,176.259,Whakarewarewa Feature 71,Cool temperature spring covered with a layer of yellow pollen. In a series of three pools the same temperature. No inputs or outputs. Surrounded by Manuka.,manually saved 1000 Springs mapsearch page source,Creative Commons Attribution-NonCommercial-ShareAlike 4.0 International,"1000 Springs Project authors, GNS Science, and University of Waikato",2026-05-27T04:53:01.287596+00:00
891,https://1000springs.org.nz/samplesite/891,/samplesite/891,Rotorua,-38.1622,176.2592,Whakarewarewa Feature 73,"Lake Tamaheke at Whakarewarewa. Sample taken from north side near the old path. Surrounded by vegetation on most sides, this lake has many inputs and outputs. And some seagulls hanging out on the east side.",manually saved 1000 Springs mapsearch page source,Creative Commons Attribution-NonCommercial-ShareAlike 4.0 International,"1000 Springs Project authors, GNS Science, and University of Waikato",2026-05-27T04:53:01.287622+00:00
892,https://1000springs.org.nz/samplesite/892,/samplesite/892,Rotorua,-38.1621,176.2591,Whakarewarewa Feature 74,Large spring adjacent to Lake Tamaheke on the north west side. Connected to the lake but has it's own sources. Some Manuka surround it sparingly. It has a deep aqua colour to it.,manually saved 1000 Springs mapsearch page source,Creative Commons Attribution-NonCommercial-ShareAlike 4.0 International,"1000 Springs Project authors, GNS Science, and University of Waikato",2026-05-27T04:53:01.287646+00:00
893,https://1000springs.org.nz/samplesite/893,/samplesite/893,Rotorua,-38.1621,176.2588,Whakarewarewa Feature 75,Karen's spring at Whakarewarewa. Surrounded by hard sinter with zero vegetation and no visible inputs or outputs. Some macroorganisms floating on top.,manually saved 1000 Springs mapsearch page source,Creative Commons Attribution-NonCommercial-ShareAlike 4.0 International,"1000 Springs Project authors, GNS Science, and University of Waikato",2026-05-27T04:53:01.287667+00:00
894,https://1000springs.org.nz/samplesite/894,/samplesite/894,Rotorua,-38.1621,176.2588,Whakarewarewa Feature 76,Spring immediately west of Feature 75. Cannot see any connection but could be. There's a bridge in the middle of this one. Very sparse vegetation growing around it. Appears very deep.,manually saved 1000 Springs mapsearch page source,Creative Commons Attribution-NonCommercial-ShareAlike 4.0 International,"1000 Springs Project authors, GNS Science, and University of Waikato",2026-05-27T04:53:01.287691+00:00
895,https://1000springs.org.nz/samplesite/895,/samplesite/895,Rotorua,-38.1621,176.2587,Whakarewarewa Feature 77,"Large spring called Ororea connected to Lake Tamaheke by three small channels. Lots of floating scum on top, with grey sediment built up on one side. Sparse Manuka surrounds it.",manually saved 1000 Springs mapsearch page source,Creative Commons Attribution-NonCommercial-ShareAlike 4.0 International,"1000 Springs Project authors, GNS Science, and University of Waikato",2026-05-27T04:53:01.287715+00:00
896,https://1000springs.org.nz/samplesite/896,/samplesite/896,Rotorua,-38.1622,176.2587,Whakarewarewa Feature 78,Spring in one side of a hollow that is most likely connected to a water body on the opposite side of hollow. Same temperature. Some weeds growing around edges. No inputs or outputs. Brown sediment.,manually saved 1000 Springs mapsearch page source,Creative Commons Attribution-NonCommercial-ShareAlike 4.0 International,"1000 Springs Project authors, GNS Science, and University of Waikato",2026-05-27T04:53:01.287741+00:00
897,https://1000springs.org.nz/samplesite/897,/samplesite/897,Rotorua,-38.1622,176.2587,Whakarewarewa Feature 79,Another spring in a hollow with a small spring on other side. Probably connected. Sparse vegetation and hard sinter surrounds.,manually saved 1000 Springs mapsearch page source,Creative Commons Attribution-NonCommercial-ShareAlike 4.0 International,"1000 Springs Project authors, GNS Science, and University of Waikato",2026-05-27T04:53:01.287759+00:00
898,https://1000springs.org.nz/samplesite/898,/samplesite/898,Rotorua,-38.1622,176.2586,Whakarewarewa Feature 80,Spring adjacent to Lake Tamaheke. The two connect via a small channel. Manuka trees dot around the edges. Floating organic matter on top.,manually saved 1000 Springs mapsearch page source,Creative Commons Attribution-NonCommercial-ShareAlike 4.0 International,"1000 Springs Project authors, GNS Science, and University of Waikato",2026-05-27T04:53:01.287779+00:00
899,https://1000springs.org.nz/samplesite/899,/samplesite/899,Rotorua,-38.1621,176.2586,Whakarewarewa Feature 81,Spring connected to a larger one to the west. Surrounded by two metre high walls. Grey/brown sediment around it. Some Manuka trees on one side. No other outputs.,manually saved 1000 Springs mapsearch page source,Creative Commons Attribution-NonCommercial-ShareAlike 4.0 International,"1000 Springs Project authors, GNS Science, and University of Waikato",2026-05-27T04:53:01.287800+00:00
900,https://1000springs.org.nz/samplesite/900,/samplesite/900,Rotorua,-38.1621,176.2585,Whakarewarewa Feature 82,"Spring connected to Feature 81. Has a few large Manuka trees around its edges. Very undercut on one side. Floating sediment, brown. Lots of wooden planks exist at one end.",manually saved 1000 Springs mapsearch page source,Creative Commons Attribution-NonCommercial-ShareAlike 4.0 International,"1000 Springs Project authors, GNS Science, and University of Waikato",2026-05-27T04:53:01.287824+00:00
901,https://1000springs.org.nz/samplesite/901,/samplesite/901,Rotorua,-38.1619,176.2587,Whakarewarewa Feature 83,Medium sized spring at Whakarewarewa in close proximity to other springs but much cooler. Pollen rests on top and sparse Manuka surrounds. No inputs or outputs. Green coloured sediment.,manually saved 1000 Springs mapsearch page source,Creative Commons Attribution-NonCommercial-ShareAlike 4.0 International,"1000 Springs Project authors, GNS Science, and University of Waikato",2026-05-27T04:53:01.287846+00:00
902,https://1000springs.org.nz/samplesite/902,/samplesite/902,Rotorua,-38.162,176.2584,Whakarewarewa Feature 84,"Vivid opal green coloured pool with lots of squirms floating on top. Surrounded by Manuka bushes, this spring could be connected to Feature 82 if the water table was higher. Planks of wood hang out at one end.",manually saved 1000 Springs mapsearch page source,Creative Commons Attribution-NonCommercial-ShareAlike 4.0 International,"1000 Springs Project authors, GNS Science, and University of Waikato",2026-05-27T04:53:01.287872+00:00
903,https://1000springs.org.nz/samplesite/903,/samplesite/903,Rotorua,-38.1623,176.2585,Whakarewarewa Feature 85,"Green milky coloured spring surrounded by Manuka trees, on the north west side of Lake Tamaheke. Bubbles floating on top. No visible inputs or outputs.",manually saved 1000 Springs mapsearch page source,Creative Commons Attribution-NonCommercial-ShareAlike 4.0 International,"1000 Springs Project authors, GNS Science, and University of Waikato",2026-05-27T04:53:01.287891+00:00
904,https://1000springs.org.nz/samplesite/904,/samplesite/904,Rotorua,-38.1621,176.2582,Whakarewarewa Feature 86,Awesome spring hidden in the Manuka on the south side of the friendship walk. Overhanging Manuka and white sediment surrounds pool. No outputs. Lots of dead branches in it.,manually saved 1000 Springs mapsearch page source,Creative Commons Attribution-NonCommercial-ShareAlike 4.0 International,"1000 Springs Project authors, GNS Science, and University of Waikato",2026-05-27T04:53:01.287912+00:00
905,https://1000springs.org.nz/samplesite/905,/samplesite/905,Rotorua,-38.1622,176.2583,Whakarewarewa Feature 87,Hot spring surrounded by lots of hollows right next to the friendship walk. Water a pale blue slate colour. No interactions with neighboring springs visible. No immediate vegetation. Small piece of wood at one end.,manually saved 1000 Springs mapsearch page source,Creative Commons Attribution-NonCommercial-ShareAlike 4.0 International,"1000 Springs Project authors, GNS Science, and University of Waikato",2026-05-27T04:53:01.287936+00:00
906,https://1000springs.org.nz/samplesite/906,/samplesite/906,Rotorua,-38.1622,176.2584,Whakarewarewa Feature 88,"Floating sheen on top, surrounded by collapsed geothermal altered rock. 1.5 metres down a hollow. No vegetation surrounds. No visible connections.",manually saved 1000 Springs mapsearch page source,Creative Commons Attribution-NonCommercial-ShareAlike 4.0 International,"1000 Springs Project authors, GNS Science, and University of Waikato",2026-05-27T04:53:01.287955+00:00
907,https://1000springs.org.nz/samplesite/907,/samplesite/907,Rotorua,-38.1622,176.2583,Whakarewarewa Feature 89,Blue/green coloured spring with Manuka on one side. Lots of bubbles and squirts floating on top. Pale brown sediment around edges. No outputs.,manually saved 1000 Springs mapsearch page source,Creative Commons Attribution-NonCommercial-ShareAlike 4.0 International,"1000 Springs Project authors, GNS Science, and University of Waikato",2026-05-27T04:53:01.287974+00:00
908,https://1000springs.org.nz/samplesite/908,/samplesite/908,Rotorua,-38.1623,176.2583,Whakarewarewa Feature 90,Spring immediately adjacent to Feature 89. Again a green/blue colour slightly more vivid than Feature 89. Manuka on one side. Beige sediment. No outputs.,manually saved 1000 Springs mapsearch page source,Creative Commons Attribution-NonCommercial-ShareAlike 4.0 International,"1000 Springs Project authors, GNS Science, and University of Waikato",2026-05-27T04:53:01.287994+00:00
909,https://1000springs.org.nz/samplesite/909,/samplesite/909,Rotorua,-38.1622,176.2582,Whakarewarewa Feature 91,Small spring behind Features 89 & 90. Surrounded by muddy walls and some Manuka. Lots of dead branches in it. No connections with neighbouring features.,manually saved 1000 Springs mapsearch page source,Creative Commons Attribution-NonCommercial-ShareAlike 4.0 International,"1000 Springs Project authors, GNS Science, and University of Waikato",2026-05-27T04:53:01.288014+00:00
910,https://1000springs.org.nz/samplesite/910,/samplesite/910,Rotorua,-38.1622,176.2583,Whakarewarewa Feature 92,Vivid aqua green coloured spring. Full of fallen stars (tiny leaves in the shape of stars). Overhanging vegetation on one side. Intermittent bubbling. No visible outputs.,manually saved 1000 Springs mapsearch page source,Creative Commons Attribution-NonCommercial-ShareAlike 4.0 International,"1000 Springs Project authors, GNS Science, and University of Waikato",2026-05-27T04:53:01.288034+00:00
911,https://1000springs.org.nz/samplesite/911,/samplesite/911,Rotorua,-38.1624,176.2581,Whakarewarewa Feature 93,Sample taken after rain. This spring is divided into two pools which most likely are connected. Two temperatures are exactly the same. Sample taken from the back (or west) spring. Overhanging Manuka and no visible inputs or outputs. Lots of dead twigs in pools.,manually saved 1000 Springs mapsearch page source,Creative Commons Attribution-NonCommercial-ShareAlike 4.0 International,"1000 Springs Project authors, GNS Science, and University of Waikato",2026-05-27T04:53:01.288063+00:00
912,https://1000springs.org.nz/samplesite/912,/samplesite/912,Rotorua,-38.1624,176.2583,Whakarewarewa Feature 94,"Sample taken after rain. Sample taken near Canada tree on the Friendship Walk at Whakarewarewa Village. No visible connections to lake, it's surrounded by sparse Manuka.",manually saved 1000 Springs mapsearch page source,Creative Commons Attribution-NonCommercial-ShareAlike 4.0 International,"1000 Springs Project authors, GNS Science, and University of Waikato",2026-05-27T04:53:01.288085+00:00
913,https://1000springs.org.nz/samplesite/913,/samplesite/913,Rotorua,-38.1625,176.2583,Whakarewarewa Feature 95,Sample taken after rain. Spring on the western side of Lake Tamaheke. Two large Manuka bushes overhang on one side. May be connected to feature 96 but not visible.,manually saved 1000 Springs mapsearch page source,Creative Commons Attribution-NonCommercial-ShareAlike 4.0 International,"1000 Springs Project authors, GNS Science, and University of Waikato",2026-05-27T04:53:01.288105+00:00
914,https://1000springs.org.nz/samplesite/914,/samplesite/914,Rotorua,-38.1626,176.2584,Whakarewarewa Feature 96,Sample taken after rain. This may be connected to three of it's neighbours but not visible. Almost zero vegetation surrounds. Temperature taken from very top of the water column. 68 degree Celsius 0.1 metres deeper.,manually saved 1000 Springs mapsearch page source,Creative Commons Attribution-NonCommercial-ShareAlike 4.0 International,"1000 Springs Project authors, GNS Science, and University of Waikato",2026-05-27T04:53:01.288131+00:00
915,https://1000springs.org.nz/samplesite/915,/samplesite/915,Rotorua,-38.1625,176.2583,Whakarewarewa Feature 97,"Sample taken after rain. This spring is visibly connected by a small channel to spring behind it or east of it. Surrounded by rocks, no vegetation.",manually saved 1000 Springs mapsearch page source,Creative Commons Attribution-NonCommercial-ShareAlike 4.0 International,"1000 Springs Project authors, GNS Science, and University of Waikato",2026-05-27T04:53:01.288150+00:00
916,https://1000springs.org.nz/samplesite/916,/samplesite/916,Rotorua,-38.1626,176.2584,Whakarewarewa Feature 98,Sample taken after rain. This hot spring is right next to Lake Tamaheke. Some dead vegetation situated on the south side only. Rocks everywhere else. Connected to Feature 97 via small channel. A sinter surrounds it.,manually saved 1000 Springs mapsearch page source,Creative Commons Attribution-NonCommercial-ShareAlike 4.0 International,"1000 Springs Project authors, GNS Science, and University of Waikato",2026-05-27T04:53:01.288175+00:00
917,https://1000springs.org.nz/samplesite/917,/samplesite/917,Rotorua,-38.1626,176.2584,Whakarewarewa Feature 99,Sample taken after rain. Spring east of Feature 95. No visible connections. Some shrubs exist on one side. No visible outputs.,manually saved 1000 Springs mapsearch page source,Creative Commons Attribution-NonCommercial-ShareAlike 4.0 International,"1000 Springs Project authors, GNS Science, and University of Waikato",2026-05-27T04:53:01.288191+00:00
918,https://1000springs.org.nz/samplesite/918,/samplesite/918,Rotorua,-38.1626,176.2583,Whakarewarewa Feature 100,Sample taken after rain. Small spring adjacent to Feature 97 on the south. Catchment area under rock to the south. No immediate vegetation. No visible outputs. Green biomass growing on walls above spring.,manually saved 1000 Springs mapsearch page source,Creative Commons Attribution-NonCommercial-ShareAlike 4.0 International,"1000 Springs Project authors, GNS Science, and University of Waikato",2026-05-27T04:53:01.288216+00:00
919,https://1000springs.org.nz/samplesite/919,/samplesite/919,Rotorua,-38.1627,176.2583,Whakarewarewa Feature 101,Sample taken after rain. Hot spring near the path. Surrounded by sinter. No visible connections. Manuka about a metre back on one side. Grey coloured sediment at bottom of spring.,manually saved 1000 Springs mapsearch page source,Creative Commons Attribution-NonCommercial-ShareAlike 4.0 International,"1000 Springs Project authors, GNS Science, and University of Waikato",2026-05-27T04:53:01.288237+00:00
920,https://1000springs.org.nz/samplesite/920,/samplesite/920,Rotorua,-38.1627,176.2583,Whakarewarewa Feature 102,Sample taken after rain. Spring directly behind Feature 101 to the east. Some bubbles floating to the surface. No immediate vegetation and surrounded by a sinter. Probably connected to Feature 101 but no visible.,manually saved 1000 Springs mapsearch page source,Creative Commons Attribution-NonCommercial-ShareAlike 4.0 International,"1000 Springs Project authors, GNS Science, and University of Waikato",2026-05-27T04:53:01.288261+00:00
921,https://1000springs.org.nz/samplesite/921,/samplesite/921,Rotorua,-38.1627,176.2584,Whakarewarewa Feature 103,"Sample taken after rain. To the east of Features 101 & 102. This spring has an awesome multicoloured sinter surrounding it with green, orange and white colours. No visible outputs. Bush on one side slightly back from edge of sinter.",manually saved 1000 Springs mapsearch page source,Creative Commons Attribution-NonCommercial-ShareAlike 4.0 International,"1000 Springs Project authors, GNS Science, and University of Waikato",2026-05-27T04:53:01.288288+00:00
922,https://1000springs.org.nz/samplesite/922,/samplesite/922,Rotorua,-38.1644,176.2546,Te Puia Feature 51,"Very interesting spring that has a major upwelling intermittenly, after 5 minutes or 20 minutes. The upwelling lasts 2-3 minutes. Zero vegetation surrounding and no visible inputs or outputs. A steam fumerole exists on the south side which vents steam and liquid in between eruptions of the main spring.",manually saved 1000 Springs mapsearch page source,Creative Commons Attribution-NonCommercial-ShareAlike 4.0 International,"1000 Springs Project authors, GNS Science, and University of Waikato",2026-05-27T04:53:01.288318+00:00
923,https://1000springs.org.nz/samplesite/923,/samplesite/923,Rotorua,-38.1639,176.2543,Te Puia Feature 52,"Slightly south east of Pohutu Geyser, this spring is bubbling profusely. No vegetation or outputs. Bright yellow precipitate on rock above the spring.",manually saved 1000 Springs mapsearch page source,Creative Commons Attribution-NonCommercial-ShareAlike 4.0 International,"1000 Springs Project authors, GNS Science, and University of Waikato",2026-05-27T04:53:01.288338+00:00
924,https://1000springs.org.nz/samplesite/924,/samplesite/924,Rotorua,-38.1633,176.2545,Te Puia Feature 53,Blue Lake at Te Puia. Vivid blue colour with yellow pollwn all around the edges. No much vegetation surrounding it except some grass on north side. Minor output down a terrace into Puarenga Stream.,manually saved 1000 Springs mapsearch page source,Creative Commons Attribution-NonCommercial-ShareAlike 4.0 International,"1000 Springs Project authors, GNS Science, and University of Waikato",2026-05-27T04:53:01.288361+00:00
925,https://1000springs.org.nz/samplesite/925,/samplesite/925,Rotorua,-38.1633,176.2548,Te Puia Feature 54,Medium sized pool with lots of independent bubbling spots. A brown/green in colour. No vegetation surrounding or outputs. Some 70 degree Celsius gas vents on south side directly adjacent to it.,manually saved 1000 Springs mapsearch page source,Creative Commons Attribution-NonCommercial-ShareAlike 4.0 International,"1000 Springs Project authors, GNS Science, and University of Waikato",2026-05-27T04:53:01.288383+00:00
926,https://1000springs.org.nz/samplesite/926,/samplesite/926,Rotorua,-38.1632,176.2547,Te Puia Feature 55,"Spring right next to Feature 54, north of it. Ebullition is extremely minor and intermittent. No vegetation or outputs. Colour is more blue than 54. Lots of brown scum floating on top.",manually saved 1000 Springs mapsearch page source,Creative Commons Attribution-NonCommercial-ShareAlike 4.0 International,"1000 Springs Project authors, GNS Science, and University of Waikato",2026-05-27T04:53:01.288404+00:00
927,https://1000springs.org.nz/samplesite/927,/samplesite/927,Rotorua,-38.1628,176.2545,Te Puia Feature 56,Awesome hidden spring surrounded completely by overhanging vegetation. Dead branches in spring. Black precipitate around edges. No visible outputs. Ebullition is quite major.,manually saved 1000 Springs mapsearch page source,Creative Commons Attribution-NonCommercial-ShareAlike 4.0 International,"1000 Springs Project authors, GNS Science, and University of Waikato",2026-05-27T04:53:01.288424+00:00
928,https://1000springs.org.nz/samplesite/928,/samplesite/928,Rotorua,-38.1627,176.2582,Whakarewarewa Feature 104,Clear pool situated right next to the Friendship Walk at Whakarewarewa. No visible outputs and vegetation about a metre back on one side. Grey sediment on bottom of spring.,manually saved 1000 Springs mapsearch page source,Creative Commons Attribution-NonCommercial-ShareAlike 4.0 International,"1000 Springs Project authors, GNS Science, and University of Waikato",2026-05-27T04:53:01.288445+00:00
929,https://1000springs.org.nz/samplesite/929,/samplesite/929,Rotorua,-38.1627,176.2582,Whakarewarewa Feature 105,Spring across the path from Feature 104 on the Friendship Walk. Clear with grey sediment on bottom. Manuka trees on one side. Small channel connecting it to a smaller spring that we can't reach.,manually saved 1000 Springs mapsearch page source,Creative Commons Attribution-NonCommercial-ShareAlike 4.0 International,"1000 Springs Project authors, GNS Science, and University of Waikato",2026-05-27T04:53:01.288471+00:00
930,https://1000springs.org.nz/samplesite/930,/samplesite/930,Rotorua,-38.1627,176.2581,Whakarewarewa Feature 106,Spring completely connected to Feature 107 but 10 degree Celsius cooler. Grey sediment on bottom and no other visible outputs. Dead Manuka on one side. Some green biomass growing on walls above spring.,manually saved 1000 Springs mapsearch page source,Creative Commons Attribution-NonCommercial-ShareAlike 4.0 International,"1000 Springs Project authors, GNS Science, and University of Waikato",2026-05-27T04:53:01.288495+00:00
931,https://1000springs.org.nz/samplesite/931,/samplesite/931,Rotorua,-38.1628,176.2582,Whakarewarewa Feature 107,"Very hot, very deep spring. No immediately vegetation, except for some Manuka about a metre back one side. Grey sediment on sides of spring.",manually saved 1000 Springs mapsearch page source,Creative Commons Attribution-NonCommercial-ShareAlike 4.0 International,"1000 Springs Project authors, GNS Science, and University of Waikato",2026-05-27T04:53:01.288515+00:00
932,https://1000springs.org.nz/samplesite/932,/samplesite/932,Rotorua,-38.1627,176.2581,Whakarewarewa Feature 108,Dead branches in spring with lots of grey sediment. No visible outputs. Overhanging sinter walls with green biomass growing. No immediate vegetation.,manually saved 1000 Springs mapsearch page source,Creative Commons Attribution-NonCommercial-ShareAlike 4.0 International,"1000 Springs Project authors, GNS Science, and University of Waikato",2026-05-27T04:53:01.288534+00:00
933,https://1000springs.org.nz/samplesite/933,/samplesite/933,Rotorua,-38.1628,176.2582,Whakarewarewa Feature 109,Hotspring that outflows into Lake Tamaheke. Dead Manuka on one side. Streamers growing in outflow to lake. Brown sediment surrounding spring.,manually saved 1000 Springs mapsearch page source,Creative Commons Attribution-NonCommercial-ShareAlike 4.0 International,"1000 Springs Project authors, GNS Science, and University of Waikato",2026-05-27T04:53:01.288553+00:00
934,https://1000springs.org.nz/samplesite/934,/samplesite/934,Rotorua,-38.1628,176.2582,Whakarewarewa Feature 110,Spring immediately south of Feature 109. No visible connections to neighbouring springs. Lots of intermittent bubbling. Dead branches in spring and grey sediment.,manually saved 1000 Springs mapsearch page source,Creative Commons Attribution-NonCommercial-ShareAlike 4.0 International,"1000 Springs Project authors, GNS Science, and University of Waikato",2026-05-27T04:53:01.288573+00:00
