source_id,source_url,path,geothermal_system,latitude,longitude,name,map_description,source,source_licence,attribution,parsed_at_utc
244,https://1000springs.org.nz/samplesite/244,/samplesite/244,Waimangu,-38.2831,176.3967,Waimangu Stream Feature 1,Stream that flows from Frying Pan Lake. Sample taken as close to the start of the outlet as possible. Lots of gas and green biomass floating.,manually saved 1000 Springs mapsearch page source,Creative Commons Attribution-NonCommercial-ShareAlike 4.0 International,"1000 Springs Project authors, GNS Science, and University of Waikato",2026-05-27T04:53:01.274874+00:00
245,https://1000springs.org.nz/samplesite/245,/samplesite/245,Waimangu,-38.2828,176.3977,Waimangu Stream Feature 2,"Waimangu Stream, about 150m downstream from lake and where feature 1 was taken. Fast flowing.",manually saved 1000 Springs mapsearch page source,Creative Commons Attribution-NonCommercial-ShareAlike 4.0 International,"1000 Springs Project authors, GNS Science, and University of Waikato",2026-05-27T04:53:01.275095+00:00
246,https://1000springs.org.nz/samplesite/246,/samplesite/246,Waimangu,-38.2828,176.3991,Waimangu Stream Feature 3,"This sample was taken further downstream of Feature 2, at first bridge that crosses over Waimangu Stream. Lots of green biomass on the bed of the stream. Matt's phone likes to swim here sometimes. Lots of overhanging grass on the stream banks too.",manually saved 1000 Springs mapsearch page source,Creative Commons Attribution-NonCommercial-ShareAlike 4.0 International,"1000 Springs Project authors, GNS Science, and University of Waikato",2026-05-27T04:53:01.275142+00:00
247,https://1000springs.org.nz/samplesite/247,/samplesite/247,Waimangu,-38.2828,176.3993,Waimangu Stream Feature 4,"This sample was taken from Waimangu Stream, downstream from the Inferno Crater inlet and the second bridge of stream, but before Clamshell Spring. There is a large rock on the stream's edge. Long grass overhangs the banks.",manually saved 1000 Springs mapsearch page source,Creative Commons Attribution-NonCommercial-ShareAlike 4.0 International,"1000 Springs Project authors, GNS Science, and University of Waikato",2026-05-27T04:53:01.275178+00:00
248,https://1000springs.org.nz/samplesite/248,/samplesite/248,Waimangu,-38.2831,176.4009,Waimangu Stream Feature 5,"This sampling point was near Bus Stop 1 at Waimangu, down the embankment by the start of the path to Inferno Crater. It is fast flowing with lots of green biomass. The stream separates into a v-shape by an island immediately after the sampling point. Lots of trees overhang also.",manually saved 1000 Springs mapsearch page source,Creative Commons Attribution-NonCommercial-ShareAlike 4.0 International,"1000 Springs Project authors, GNS Science, and University of Waikato",2026-05-27T04:53:01.275215+00:00
249,https://1000springs.org.nz/samplesite/249,/samplesite/249,Waimangu,-38.2758,176.4132,Waimangu Stream Feature 7,Sample taken near inlet of Waimangu Stream to Lake Rotomahana. Lots of black swans nearby at the time of sampling. Some trees overhang also and there is grass on the banks.,manually saved 1000 Springs mapsearch page source,Creative Commons Attribution-NonCommercial-ShareAlike 4.0 International,"1000 Springs Project authors, GNS Science, and University of Waikato",2026-05-27T04:53:01.275241+00:00
250,https://1000springs.org.nz/samplesite/250,/samplesite/250,Waimangu,-38.2785,176.4104,Waimangu Stream Feature 6,This sample was taken close to the bridge near Bus Stop 2 at Waimangu. The stream has a medium flow rate at this point and has also widened considerably from upstream. There is long grass on both banks. And lots of biomass on the bed of the stream.,manually saved 1000 Springs mapsearch page source,Creative Commons Attribution-NonCommercial-ShareAlike 4.0 International,"1000 Springs Project authors, GNS Science, and University of Waikato",2026-05-27T04:53:01.275273+00:00
251,https://1000springs.org.nz/samplesite/251,/samplesite/251,Waimangu,-38.2779,176.4095,Waterfall Spring,This spring flows into a small pool (like a small waterfall) which then overflows into the stream at Warbrick Terrace. Lots of vegetation overhangs and rocks make up the spring bed.,manually saved 1000 Springs mapsearch page source,Creative Commons Attribution-NonCommercial-ShareAlike 4.0 International,"1000 Springs Project authors, GNS Science, and University of Waikato",2026-05-27T04:53:01.275297+00:00
252,https://1000springs.org.nz/samplesite/252,/samplesite/252,Waimangu,-38.2784,176.4088,Warbrick Terrace Feature 1,"This is the main spring at Warbrick Terrace. It has a small amount of overhanging vegetation at the back but otherwise, it is surrounded by an orange, spongy biomat. No outflow visible.",manually saved 1000 Springs mapsearch page source,Creative Commons Attribution-NonCommercial-ShareAlike 4.0 International,"1000 Springs Project authors, GNS Science, and University of Waikato",2026-05-27T04:53:01.275323+00:00
253,https://1000springs.org.nz/samplesite/253,/samplesite/253,Waimangu,-38.2781,176.4091,Warbrick Terrace Feature 2,"Small spring, burnt orange in colour, about 30m downstream of Feature 1 on the Warbrick plateau. A green/orange biomat surrounds this spring, small outflow onto the mat.",manually saved 1000 Springs mapsearch page source,Creative Commons Attribution-NonCommercial-ShareAlike 4.0 International,"1000 Springs Project authors, GNS Science, and University of Waikato",2026-05-27T04:53:01.275347+00:00
254,https://1000springs.org.nz/samplesite/254,/samplesite/254,Waimangu,-38.2793,176.4092,Iodine Pool,"Iodine Pool at Waimangu is fed from a geyser that erupts regularly. It has a light brown colour, like iodine. No outflow visible and some vegetation overhangs pool.",manually saved 1000 Springs mapsearch page source,Creative Commons Attribution-NonCommercial-ShareAlike 4.0 International,"1000 Springs Project authors, GNS Science, and University of Waikato",2026-05-27T04:53:01.275370+00:00
255,https://1000springs.org.nz/samplesite/255,/samplesite/255,Waimangu,-38.2821,176.3991,Inferno Crater,"Larger crater lake with geyser underneath. It has monthly (approx) cycles where the temperature ranges from 30 to 80 degree celsius. At its highest temperature, the lake overflows into a stream that joins with Waimangu Stream near Bird's Nest Geyser.",manually saved 1000 Springs mapsearch page source,Creative Commons Attribution-NonCommercial-ShareAlike 4.0 International,"1000 Springs Project authors, GNS Science, and University of Waikato",2026-05-27T04:53:01.275402+00:00
256,https://1000springs.org.nz/samplesite/256,/samplesite/256,Waimangu,-38.2829,176.3989,Waimangu No.16 Feature 1,"A small spring that's very bubbly and audible. It is adjacent to Waimangu Stream and can be found at feature number 16, just before the first bridge. It outflows into a pool in front of it. Some biofilm overhangs it, otherwise no vegetation.",manually saved 1000 Springs mapsearch page source,Creative Commons Attribution-NonCommercial-ShareAlike 4.0 International,"1000 Springs Project authors, GNS Science, and University of Waikato",2026-05-27T04:53:01.275434+00:00
257,https://1000springs.org.nz/samplesite/257,/samplesite/257,Waimangu,-38.2828,176.3989,Waimangu No.16 Feature 2,"Pool immediately adjacent to Feature 1 (Feature 1 runs into this pool). However, the pool has individual, small inputs on its bed. Lots of pock-marked grey and brown sediment on bed also. Runs into Waimangu Stream. Vegetation about 30 cm back from the edge.",manually saved 1000 Springs mapsearch page source,Creative Commons Attribution-NonCommercial-ShareAlike 4.0 International,"1000 Springs Project authors, GNS Science, and University of Waikato",2026-05-27T04:53:01.275466+00:00
258,https://1000springs.org.nz/samplesite/258,/samplesite/258,Waimangu,-38.2829,176.3989,Waimangu No.16 Feature 3,Small spring with orange colour sediment surrounding it. Outflows into Waimangu Stream. Spare vegetation exists about 30 cm from this spring but it doesn't overhang.,manually saved 1000 Springs mapsearch page source,Creative Commons Attribution-NonCommercial-ShareAlike 4.0 International,"1000 Springs Project authors, GNS Science, and University of Waikato",2026-05-27T04:53:01.275491+00:00
259,https://1000springs.org.nz/samplesite/259,/samplesite/259,Waimangu,-38.2828,176.3989,Waimangu No.16 Feature 4,"Spring nearest to Waimangu Stream on this plateau. It's surrounded by a hard silica boundry, and outflows into the stream. No vegetation overhangs.",manually saved 1000 Springs mapsearch page source,Creative Commons Attribution-NonCommercial-ShareAlike 4.0 International,"1000 Springs Project authors, GNS Science, and University of Waikato",2026-05-27T04:53:01.275514+00:00
260,https://1000springs.org.nz/samplesite/260,/samplesite/260,Waimangu,-38.2828,176.3989,Waimangu No.16 Feature 5,"Small spring on the edge of Waimangu Stream, about five metres downstream of the plateau at Number 16. Branches and vegetation overhang this spring and it outflows into the stream.",manually saved 1000 Springs mapsearch page source,Creative Commons Attribution-NonCommercial-ShareAlike 4.0 International,"1000 Springs Project authors, GNS Science, and University of Waikato",2026-05-27T04:53:01.275538+00:00
261,https://1000springs.org.nz/samplesite/261,/samplesite/261,Waimangu,-38.2829,176.3987,Waimangu No.14 Feature 1,"Eruptive, small spring that looks like it is boiling. It has an orange colour around the outside and no vegetation nearby. It is surrounded by dead twigs however.",manually saved 1000 Springs mapsearch page source,Creative Commons Attribution-NonCommercial-ShareAlike 4.0 International,"1000 Springs Project authors, GNS Science, and University of Waikato",2026-05-27T04:53:01.275561+00:00
262,https://1000springs.org.nz/samplesite/262,/samplesite/262,Waimangu,-38.2828,176.3986,Waimangu No.14 Feature 2,Heart-shaped spring close to Feature 1 on the plateau at No. 14. Hard silica surrounds this spring with zero vegetation. No visible outflow.,manually saved 1000 Springs mapsearch page source,Creative Commons Attribution-NonCommercial-ShareAlike 4.0 International,"1000 Springs Project authors, GNS Science, and University of Waikato",2026-05-27T04:53:01.275585+00:00
263,https://1000springs.org.nz/samplesite/263,/samplesite/263,Waimangu,-38.2827,176.3986,Waimangu No.14 Feature 3,"This spring sits to the left of heart shaped spring (Feature 2). It looks like it is boiling, with lots of sediment on its bed. Zero vegetation surrounding it. It outflows into Waimangu Stream.",manually saved 1000 Springs mapsearch page source,Creative Commons Attribution-NonCommercial-ShareAlike 4.0 International,"1000 Springs Project authors, GNS Science, and University of Waikato",2026-05-27T04:53:01.275612+00:00
264,https://1000springs.org.nz/samplesite/264,/samplesite/264,Waimangu,-38.2827,176.3986,Waimangu No.14 Feature 4,"This spring sits to the left of Feature 1, and is the middle spring of three small springs in a row. This one looks like a ""birds nest"", and has a build up of biofilm around its edges.",manually saved 1000 Springs mapsearch page source,Creative Commons Attribution-NonCommercial-ShareAlike 4.0 International,"1000 Springs Project authors, GNS Science, and University of Waikato",2026-05-27T04:53:01.275641+00:00
265,https://1000springs.org.nz/samplesite/265,/samplesite/265,Waimangu,-38.2829,176.3985,Waimangu No.15 Feature 1,"Pink spring that looks very turbid. The ground is unstable surrounding this spring and looks acidic. There is pink sediment at the sides, with no surrounding vegetation. No visible outflow.",manually saved 1000 Springs mapsearch page source,Creative Commons Attribution-NonCommercial-ShareAlike 4.0 International,"1000 Springs Project authors, GNS Science, and University of Waikato",2026-05-27T04:53:01.275667+00:00
266,https://1000springs.org.nz/samplesite/266,/samplesite/266,Waimangu,-38.283,176.3985,Waimangu No.15 Feature 2,"Pock-marked sediment on the bottom of this spring, green/yellow in colour. Lots of vegetation overhangs and there is no visible outflow.",manually saved 1000 Springs mapsearch page source,Creative Commons Attribution-NonCommercial-ShareAlike 4.0 International,"1000 Springs Project authors, GNS Science, and University of Waikato",2026-05-27T04:53:01.275688+00:00
267,https://1000springs.org.nz/samplesite/267,/samplesite/267,Waiotapu,-38.3578,176.3702,Devil's Ink Pots,The last spring in this chain known as the Ink Pots. This spring is to the right of the path and has lots of grey precipitate floating on top. Looks very turbid. No vegetation or visible outputs.,manually saved 1000 Springs mapsearch page source,Creative Commons Attribution-NonCommercial-ShareAlike 4.0 International,"1000 Springs Project authors, GNS Science, and University of Waikato",2026-05-27T04:53:01.275716+00:00
268,https://1000springs.org.nz/samplesite/268,/samplesite/268,Waiotapu,-38.3582,176.3695,Artist's Palette Feature 1,"This spring is directly below the lookout for Artist's Palette and Champagne Pool at Waiotapu (to the south-east). It is green/yellow in colour, and has no visible outputs. Dense vegetation overhangs it on one side.",manually saved 1000 Springs mapsearch page source,Creative Commons Attribution-NonCommercial-ShareAlike 4.0 International,"1000 Springs Project authors, GNS Science, and University of Waikato",2026-05-27T04:53:01.275747+00:00
269,https://1000springs.org.nz/samplesite/269,/samplesite/269,Waiotapu,-38.3588,176.3705,Opal Pool,"This spring is a vivid green/yellow in colour, the water level very high so it overflows slightly onto the surrounding terrace. There is no vegetation immediately surrounding it. Some separate springs exist behind it but they are not safe to sample.",manually saved 1000 Springs mapsearch page source,Creative Commons Attribution-NonCommercial-ShareAlike 4.0 International,"1000 Springs Project authors, GNS Science, and University of Waikato",2026-05-27T04:53:01.275777+00:00
270,https://1000springs.org.nz/samplesite/270,/samplesite/270,Waiotapu,-38.3592,176.3698,Artist's Palette Feature 2,"Small spring next to the board walk at Waiotapu, which sits to the left of Jean Batten Geyser. There are no visible outputs or vegetation surrounding this spring.",manually saved 1000 Springs mapsearch page source,Creative Commons Attribution-NonCommercial-ShareAlike 4.0 International,"1000 Springs Project authors, GNS Science, and University of Waikato",2026-05-27T04:53:01.275802+00:00
271,https://1000springs.org.nz/samplesite/271,/samplesite/271,Waiotapu,-38.3571,176.3676,Devil's Bath,This spring has a vivid green colour. Some sparse vegetation hangs out around the edges but most of this is dead. There is a build up of yellow precipitation at the edge of the water. A stream flows into the spring.,manually saved 1000 Springs mapsearch page source,Creative Commons Attribution-NonCommercial-ShareAlike 4.0 International,"1000 Springs Project authors, GNS Science, and University of Waikato",2026-05-27T04:53:01.275831+00:00
272,https://1000springs.org.nz/samplesite/272,/samplesite/272,Waiotapu,-38.3589,176.3688,Champagne Pool,Most iconic hotspring in New Zealand. Amorphous red and orange precipitate around the edges. Low volume outflow over a sinter terrace. No vegetation near edges. Lots of steam clouds.,manually saved 1000 Springs mapsearch page source,Creative Commons Attribution-NonCommercial-ShareAlike 4.0 International,"1000 Springs Project authors, GNS Science, and University of Waikato",2026-05-27T04:53:01.275855+00:00
278,https://1000springs.org.nz/samplesite/278,/samplesite/278,Waiotapu,-38.3613,176.3693,Waiotapu No.13 Feature 1,"Very fast flowing stream, sample taken slightly upstream from the geyser side. Some vegetation overhangs this feature.",manually saved 1000 Springs mapsearch page source,Creative Commons Attribution-NonCommercial-ShareAlike 4.0 International,"1000 Springs Project authors, GNS Science, and University of Waikato",2026-05-27T04:53:01.275874+00:00
279,https://1000springs.org.nz/samplesite/279,/samplesite/279,Waiotapu,-38.3613,176.3693,Waiotapu No.13 Feature 2,Small spring that used to geyser but has been dormant for awhile. No vegetation surrounds it and there are no visible outputs. There is a hard sinter around this spring.,manually saved 1000 Springs mapsearch page source,Creative Commons Attribution-NonCommercial-ShareAlike 4.0 International,"1000 Springs Project authors, GNS Science, and University of Waikato",2026-05-27T04:53:01.275898+00:00
280,https://1000springs.org.nz/samplesite/280,/samplesite/280,Waiotapu,-38.3612,176.3692,Waiotapu No.13 Feature 3,Furthest spring to the right side of the bridge. It slighty overflows into the stream and some dead vegetation hangs out at one side.,manually saved 1000 Springs mapsearch page source,Creative Commons Attribution-NonCommercial-ShareAlike 4.0 International,"1000 Springs Project authors, GNS Science, and University of Waikato",2026-05-27T04:53:01.275918+00:00
281,https://1000springs.org.nz/samplesite/281,/samplesite/281,Waiotapu,-38.3613,176.3691,Waiotapu No.13 Feature 4,"Small spring with lots of precipitate on the bottom and around the edges. It slightly overflows into the output from Feature 3, and then into the stream. No vegetation except for a couple of dead branches around the edges.",manually saved 1000 Springs mapsearch page source,Creative Commons Attribution-NonCommercial-ShareAlike 4.0 International,"1000 Springs Project authors, GNS Science, and University of Waikato",2026-05-27T04:53:01.275948+00:00
282,https://1000springs.org.nz/samplesite/282,/samplesite/282,Waiotapu,-38.3612,176.3692,Waiotapu No.13 Feature 5,"This spring is adjacent to Feature 4 (to the left if looking from the bridge), but has more bubbling and gas discharge, and looks more turbid. Some very dead twigs have fallen into the spring, and there is a small outflow into the nearby stream.",manually saved 1000 Springs mapsearch page source,Creative Commons Attribution-NonCommercial-ShareAlike 4.0 International,"1000 Springs Project authors, GNS Science, and University of Waikato",2026-05-27T04:53:01.275978+00:00
283,https://1000springs.org.nz/samplesite/283,/samplesite/283,Waiotapu,-38.3614,176.369,Waiotapu No.13 Feature 6,"This is a very slow flowing stream, that has a build up of yellow precipitate on its bed (most likely due to arsenic). The spring has a large overflow into the stream. No vegetation around it except for some dead twigs.",manually saved 1000 Springs mapsearch page source,Creative Commons Attribution-NonCommercial-ShareAlike 4.0 International,"1000 Springs Project authors, GNS Science, and University of Waikato",2026-05-27T04:53:01.276008+00:00
284,https://1000springs.org.nz/samplesite/284,/samplesite/284,Waiotapu,-38.3612,176.369,Alum Cliffs Feature 1,This spring is bubbling vigorously and looks very shallow. No vegetation exists nearby and the spring has some very slight overflow (perhaps more if the water table is higher).,manually saved 1000 Springs mapsearch page source,Creative Commons Attribution-NonCommercial-ShareAlike 4.0 International,"1000 Springs Project authors, GNS Science, and University of Waikato",2026-05-27T04:53:01.276032+00:00
285,https://1000springs.org.nz/samplesite/285,/samplesite/285,Waiotapu,-38.3613,176.3688,Alum Cliffs Feature 2,This sample was taken from the converging point of three streams at the Alum Cliffs (directly across from the No.14 sign). The stream is very fast flowing at this point and there is little vegetation nearby.,manually saved 1000 Springs mapsearch page source,Creative Commons Attribution-NonCommercial-ShareAlike 4.0 International,"1000 Springs Project authors, GNS Science, and University of Waikato",2026-05-27T04:53:01.276060+00:00
294,https://1000springs.org.nz/samplesite/294,/samplesite/294,Waiotapu,-38.3614,176.3688,Alum Cliffs Feature 3,Small spring at the side of the stream by the Alum Cliffs. It's on the side of the path. Lots of gas discharge. Zero vegetation surrounds it (except for a few dead twigs) and it outflows into the stream.,manually saved 1000 Springs mapsearch page source,Creative Commons Attribution-NonCommercial-ShareAlike 4.0 International,"1000 Springs Project authors, GNS Science, and University of Waikato",2026-05-27T04:53:01.276089+00:00
295,https://1000springs.org.nz/samplesite/295,/samplesite/295,Waiotapu,-38.3613,176.3688,Alum Cliffs Feature 4,Small spring across the stream in front of the Alum Cliffs. This spring has lots of dead branches overhanging it and there a very small outflow into the stream. There is brown sediment on the bottom and a steep embankment to one side.,manually saved 1000 Springs mapsearch page source,Creative Commons Attribution-NonCommercial-ShareAlike 4.0 International,"1000 Springs Project authors, GNS Science, and University of Waikato",2026-05-27T04:53:01.276119+00:00
296,https://1000springs.org.nz/samplesite/296,/samplesite/296,Waiotapu,-38.3614,176.3688,Alum Cliffs Feature 5,This is the first spring in a series of five on the banks where the stream flows into the lake at the Alum Cliffs. This one was sampled by Katrin Hug and is immediately adjacent to the path. Zero vegetation surrounds it and there is some slight outflow into the stream.,manually saved 1000 Springs mapsearch page source,Creative Commons Attribution-NonCommercial-ShareAlike 4.0 International,"1000 Springs Project authors, GNS Science, and University of Waikato",2026-05-27T04:53:01.276151+00:00
297,https://1000springs.org.nz/samplesite/297,/samplesite/297,Waiotapu,-38.3615,176.3689,Alum Cliffs Feature 6,"This is the second spring in this series of five. It is small and immediately adjacent to the stream. There is no vegetation nearby, except for a dead branch near one end. The spring overflows into the stream.",manually saved 1000 Springs mapsearch page source,Creative Commons Attribution-NonCommercial-ShareAlike 4.0 International,"1000 Springs Project authors, GNS Science, and University of Waikato",2026-05-27T04:53:01.276179+00:00
298,https://1000springs.org.nz/samplesite/298,/samplesite/298,Waiotapu,-38.3614,176.3687,Alum Cliffs Feature 7,"The third spring in this series, this one is also small and is closest to path. No vegetation is near it and it has a dark yellow/brown colour. There are no visible outflows.",manually saved 1000 Springs mapsearch page source,Creative Commons Attribution-NonCommercial-ShareAlike 4.0 International,"1000 Springs Project authors, GNS Science, and University of Waikato",2026-05-27T04:53:01.276203+00:00
299,https://1000springs.org.nz/samplesite/299,/samplesite/299,Waiotapu,-38.3614,176.3686,Alum Cliffs Feature 8,"Katrin's spring, the fourth in this series near the Alum Cliffs. This spring is a vivid yellow colour due to high levels of arsenic. It is surrounded by small rocks and outflows into the lake. No vegetation.",manually saved 1000 Springs mapsearch page source,Creative Commons Attribution-NonCommercial-ShareAlike 4.0 International,"1000 Springs Project authors, GNS Science, and University of Waikato",2026-05-27T04:53:01.276232+00:00
300,https://1000springs.org.nz/samplesite/300,/samplesite/300,Waiotapu,-38.3611,176.3688,Alum Cliffs Feature 9,Very small spring just downstream of Feature 8. This one is more green in colour than yellow. No vegetation nearby and it outflows into the lake. Feature 8 flows into this spring sometimes.,manually saved 1000 Springs mapsearch page source,Creative Commons Attribution-NonCommercial-ShareAlike 4.0 International,"1000 Springs Project authors, GNS Science, and University of Waikato",2026-05-27T04:53:01.276257+00:00
301,https://1000springs.org.nz/samplesite/301,/samplesite/301,Waiotapu,-38.3614,176.3688,Alum Cliffs Feature 10,"This sample was taken from the large spring/lake by the Alum Cliffs. The stream flows into this lake, and then it outflows into Frying Pan Flat. The sample was taken right by the path after the Alum Cliffs sign, on the left side of the lake. Some spare vegetation, half dead, hangs out on the edges of this lake. There is a green tinge to the colour.",manually saved 1000 Springs mapsearch page source,Creative Commons Attribution-NonCommercial-ShareAlike 4.0 International,"1000 Springs Project authors, GNS Science, and University of Waikato",2026-05-27T04:53:01.276299+00:00
302,https://1000springs.org.nz/samplesite/302,/samplesite/302,Waiotapu,-38.3612,176.3688,Alum Cliffs Feature 11,"This spring is situated across the stream from the path at the Alum Cliffs. There is no visible outflow, but possibly one occurs if the water table is higher. No vegetation surrounds this spring and it looks murky and slightly green.",manually saved 1000 Springs mapsearch page source,Creative Commons Attribution-NonCommercial-ShareAlike 4.0 International,"1000 Springs Project authors, GNS Science, and University of Waikato",2026-05-27T04:53:01.276329+00:00
303,https://1000springs.org.nz/samplesite/303,/samplesite/303,Waiotapu,-38.3613,176.3688,Alum Cliffs Feature 12,"This spring is also across the stream at the Alum Cliffs like Feature 11, but this one is closer to the embankment. It's also ten degrees hotter and less turbid looking. No vegetation exists near this spring, except for a few dead branches. There is no visible output from this spring, and it is surrounded by geothermal-altered ground.",manually saved 1000 Springs mapsearch page source,Creative Commons Attribution-NonCommercial-ShareAlike 4.0 International,"1000 Springs Project authors, GNS Science, and University of Waikato",2026-05-27T04:53:01.276367+00:00
