source_id,source_url,path,geothermal_system,latitude,longitude,name,map_description,source,source_licence,attribution,parsed_at_utc
715,https://1000springs.org.nz/samplesite/715,/samplesite/715,Rotorua,-38.1296,176.2446,Kuirau Park Feature 83,"Hot pool on the east side of Kuirau Lake. Lots of separate inputs in pool, and some overflow into lake. Some vegetation around edges. Mainly grass.",manually saved 1000 Springs mapsearch page source,Creative Commons Attribution-NonCommercial-ShareAlike 4.0 International,"1000 Springs Project authors, GNS Science, and University of Waikato",2026-05-27T04:53:01.284178+00:00
716,https://1000springs.org.nz/samplesite/716,/samplesite/716,Rotorua,-38.1297,176.2443,Kuirau Park Feature 84,Another pool on the east side of Kuirau Park. Some grass surrounds this pool and there is also mixing with the lake.,manually saved 1000 Springs mapsearch page source,Creative Commons Attribution-NonCommercial-ShareAlike 4.0 International,"1000 Springs Project authors, GNS Science, and University of Waikato",2026-05-27T04:53:01.284196+00:00
717,https://1000springs.org.nz/samplesite/717,/samplesite/717,Rotorua,-38.1298,176.2438,Kuirau Park Feature 85,"Hotter section of Kuirau Lake, on the west side. Surrounded by lots of overhanging trees. Mixes with lake. Some green and grey sediment at side. No orange.",manually saved 1000 Springs mapsearch page source,Creative Commons Attribution-NonCommercial-ShareAlike 4.0 International,"1000 Springs Project authors, GNS Science, and University of Waikato",2026-05-27T04:53:01.284218+00:00
718,https://1000springs.org.nz/samplesite/718,/samplesite/718,Rotorua,-38.1301,176.2428,Kuirau Park Feature 86,"Clear pool with overhanging trees and lots of pine needles surrounding it. Feature 87 flows into this pool. Grey and orange, but no green, sediments are present.",manually saved 1000 Springs mapsearch page source,Creative Commons Attribution-NonCommercial-ShareAlike 4.0 International,"1000 Springs Project authors, GNS Science, and University of Waikato",2026-05-27T04:53:01.284240+00:00
719,https://1000springs.org.nz/samplesite/719,/samplesite/719,Rotorua,-38.1302,176.2428,Kuirau Park Feature 87,Larger and hotter spring adjacent and outflows into Feature 86. Surrounded by pine needles with overhanging trees.,manually saved 1000 Springs mapsearch page source,Creative Commons Attribution-NonCommercial-ShareAlike 4.0 International,"1000 Springs Project authors, GNS Science, and University of Waikato",2026-05-27T04:53:01.284258+00:00
720,https://1000springs.org.nz/samplesite/720,/samplesite/720,Rotorua,-38.1303,176.2424,Kuirau Park Feature 88,Low temperature geothermal pool surrounded by lots of trees. Lots of floating dead leaves.,manually saved 1000 Springs mapsearch page source,Creative Commons Attribution-NonCommercial-ShareAlike 4.0 International,"1000 Springs Project authors, GNS Science, and University of Waikato",2026-05-27T04:53:01.284274+00:00
721,https://1000springs.org.nz/samplesite/721,/samplesite/721,Rotorua,-38.1304,176.2434,Kuirau Park Feature 89,Very turbid looking pool with no visible outputs and lots of scum floating on top. Surrounded by overhanging trees.,manually saved 1000 Springs mapsearch page source,Creative Commons Attribution-NonCommercial-ShareAlike 4.0 International,"1000 Springs Project authors, GNS Science, and University of Waikato",2026-05-27T04:53:01.284292+00:00
722,https://1000springs.org.nz/samplesite/722,/samplesite/722,Rotorua,-38.1304,176.2441,Kuirau Park Feature 90,West end of Kuirau Lake. Lots of orange and green biomass growing. Surrounded by trees.,manually saved 1000 Springs mapsearch page source,Creative Commons Attribution-NonCommercial-ShareAlike 4.0 International,"1000 Springs Project authors, GNS Science, and University of Waikato",2026-05-27T04:53:01.284308+00:00
723,https://1000springs.org.nz/samplesite/723,/samplesite/723,Waimangu,-38.283,176.3986,Waimangu No.15 Feature 3,"Shallow spring at No. 15 at Waimangu. No immediate vegetation, low lying Manuka about a metre back. Surrounded by a soft sinter. Grey brown red yellow orange coloured sediment. Bubbling away happily.",manually saved 1000 Springs mapsearch page source,Creative Commons Attribution-NonCommercial-ShareAlike 4.0 International,"1000 Springs Project authors, GNS Science, and University of Waikato",2026-05-27T04:53:01.284334+00:00
724,https://1000springs.org.nz/samplesite/724,/samplesite/724,Waimangu,-38.283,176.3987,Waimangu No.15 Feature 4,"Small spring north of Waimangu No. 15 Feature 3 surrounded by soft orange biofilm. Branches from an overhanging Manuka tree dip into the pool. Grey brown sediments are present, and there is outflow into the stream.",manually saved 1000 Springs mapsearch page source,Creative Commons Attribution-NonCommercial-ShareAlike 4.0 International,"1000 Springs Project authors, GNS Science, and University of Waikato",2026-05-27T04:53:01.284360+00:00
725,https://1000springs.org.nz/samplesite/725,/samplesite/725,Waimangu,-38.2829,176.3986,Waimangu No.15 Feature 5,Tiny spring next to the pink pool (Waimangu No. 15 Feature 1). No immediate vegetation and surrounded by soft sediment. No outputs.,manually saved 1000 Springs mapsearch page source,Creative Commons Attribution-NonCommercial-ShareAlike 4.0 International,"1000 Springs Project authors, GNS Science, and University of Waikato",2026-05-27T04:53:01.284379+00:00
726,https://1000springs.org.nz/samplesite/726,/samplesite/726,Waimangu,-38.283,176.3986,Waimangu No.15 Feature 6,"The spring was covered by Manuka, and there is lots of dead branches covered by microbial mats in the pool. Lots of individual bubbling sources in the pool. Some connections to Waimangu No. 15 Feature 2 exist.",manually saved 1000 Springs mapsearch page source,Creative Commons Attribution-NonCommercial-ShareAlike 4.0 International,"1000 Springs Project authors, GNS Science, and University of Waikato",2026-05-27T04:53:01.284406+00:00
727,https://1000springs.org.nz/samplesite/727,/samplesite/727,Waimangu,-38.2827,176.3985,Waimangu No.14 Feature 13,"A small spring underneath the bank on the south side of the geothermal terrace. Brown sediments are present, and it's surrounded by dead tree branches. Outflows into stream.",manually saved 1000 Springs mapsearch page source,Creative Commons Attribution-NonCommercial-ShareAlike 4.0 International,"1000 Springs Project authors, GNS Science, and University of Waikato",2026-05-27T04:53:01.284429+00:00
728,https://1000springs.org.nz/samplesite/728,/samplesite/728,Waimangu,-38.2826,176.3985,Waimangu No.14 Feature 14,"Very hot spring surrounded by sinter and no vegetation. The sediment is an orange-brown color, and there is no visible output into nearby stream.",manually saved 1000 Springs mapsearch page source,Creative Commons Attribution-NonCommercial-ShareAlike 4.0 International,"1000 Springs Project authors, GNS Science, and University of Waikato",2026-05-27T04:53:01.284450+00:00
729,https://1000springs.org.nz/samplesite/729,/samplesite/729,Waimangu,-38.2826,176.3985,Waimangu No.14 Feature 15,The spring is immediately adjacent to Waimangu No. 14 Feature 14 and flows from/to Waimangu Stream. There is white foam floating on the surface and lots of green microbial mat growing on one side.,manually saved 1000 Springs mapsearch page source,Creative Commons Attribution-NonCommercial-ShareAlike 4.0 International,"1000 Springs Project authors, GNS Science, and University of Waikato",2026-05-27T04:53:01.284476+00:00
740,https://1000springs.org.nz/samplesite/740,/samplesite/740,Rotorua,-38.1645,176.2517,Te Puia Feature 6,Little spring situated behind Saskia's pool. Grey in colour and completely surrounded by Manuka. No visible outputs.,manually saved 1000 Springs mapsearch page source,Creative Commons Attribution-NonCommercial-ShareAlike 4.0 International,"1000 Springs Project authors, GNS Science, and University of Waikato",2026-05-27T04:53:01.284495+00:00
741,https://1000springs.org.nz/samplesite/741,/samplesite/741,Rotorua,-38.1645,176.2517,Te Puia Feature 7,This hot water stream comes from a spring immediately above it and it flows into Puarenga Stream. It has some moss at the sides and overhanging tree branches.,manually saved 1000 Springs mapsearch page source,Creative Commons Attribution-NonCommercial-ShareAlike 4.0 International,"1000 Springs Project authors, GNS Science, and University of Waikato",2026-05-27T04:53:01.284516+00:00
742,https://1000springs.org.nz/samplesite/742,/samplesite/742,Rotorua,-38.1644,176.2517,Te Puia Feature 8,"A very interesting looking pool with a black biofilm in the centre. Temperature above biofilm was 40, below was 53 and at the source 73 degrees Celsius. Surrounded by grass. Small amount of overflow.",manually saved 1000 Springs mapsearch page source,Creative Commons Attribution-NonCommercial-ShareAlike 4.0 International,"1000 Springs Project authors, GNS Science, and University of Waikato",2026-05-27T04:53:01.284541+00:00
743,https://1000springs.org.nz/samplesite/743,/samplesite/743,Rotorua,-38.1644,176.2518,Te Puia Feature 9,Spring right next to hot water stream that joins Puarenga Stream. No immediate vegetation. Grey sediment.,manually saved 1000 Springs mapsearch page source,Creative Commons Attribution-NonCommercial-ShareAlike 4.0 International,"1000 Springs Project authors, GNS Science, and University of Waikato",2026-05-27T04:53:01.284557+00:00
744,https://1000springs.org.nz/samplesite/744,/samplesite/744,Tokaanu,-38.9687,175.7624,Tokaanu Feature 29,Cool temperature pool near Paurini. Lots of overhanging trees and some white foam floats on top. No visible outputs.,manually saved 1000 Springs mapsearch page source,Creative Commons Attribution-NonCommercial-ShareAlike 4.0 International,"1000 Springs Project authors, GNS Science, and University of Waikato",2026-05-27T04:53:01.284575+00:00
745,https://1000springs.org.nz/samplesite/745,/samplesite/745,Tokaanu,-38.9685,175.7623,Tokaanu Feature 30,Small spring with some foliage around the edges and some dead branches. No visible outputs. Ebullition extremely intermittent.,manually saved 1000 Springs mapsearch page source,Creative Commons Attribution-NonCommercial-ShareAlike 4.0 International,"1000 Springs Project authors, GNS Science, and University of Waikato",2026-05-27T04:53:01.284593+00:00
746,https://1000springs.org.nz/samplesite/746,/samplesite/746,Tokaanu,-38.9685,175.7622,Tokaanu Feature 31,Hidden spring at Tokaanu beneath lots of bush. Surrounded by grass and Manuka. No visible outputs.,manually saved 1000 Springs mapsearch page source,Creative Commons Attribution-NonCommercial-ShareAlike 4.0 International,"1000 Springs Project authors, GNS Science, and University of Waikato",2026-05-27T04:53:01.284609+00:00
747,https://1000springs.org.nz/samplesite/747,/samplesite/747,Tokaanu,-38.9683,175.7622,Tokaanu Feature 32,"Small spring or part of a stream. Hard to tell as lots of reeds. Could be connected to a larger water body. Has a strange oily sheen on surface, and an orange biofilm.",manually saved 1000 Springs mapsearch page source,Creative Commons Attribution-NonCommercial-ShareAlike 4.0 International,"1000 Springs Project authors, GNS Science, and University of Waikato",2026-05-27T04:53:01.284631+00:00
748,https://1000springs.org.nz/samplesite/748,/samplesite/748,Tokaanu,-38.9682,175.7622,Tokaanu Feature 33,"Extremely intermittent bubbling spring, about every 3 minutes. Source comes from quite a deep hole. Some run off into a side catchment area right next to path. Lots of overhanging reeds.",manually saved 1000 Springs mapsearch page source,Creative Commons Attribution-NonCommercial-ShareAlike 4.0 International,"1000 Springs Project authors, GNS Science, and University of Waikato",2026-05-27T04:53:01.284653+00:00
749,https://1000springs.org.nz/samplesite/749,/samplesite/749,Tokaanu,-38.9682,175.7623,Tokaanu Feature 34,Pool at Tokaanu surrounded by reeds. Some overhanging trees also. May connect with a nearby cool temperature water body.,manually saved 1000 Springs mapsearch page source,Creative Commons Attribution-NonCommercial-ShareAlike 4.0 International,"1000 Springs Project authors, GNS Science, and University of Waikato",2026-05-27T04:53:01.284671+00:00
750,https://1000springs.org.nz/samplesite/750,/samplesite/750,Tokaanu,-38.9682,175.7624,Tokaanu Feature 35,A shallow pool that runs underneath the bridge next to it. The pool has a major outlet as it runs into a large catchment area on the other side of bridge. Surrounded by reeds.,manually saved 1000 Springs mapsearch page source,Creative Commons Attribution-NonCommercial-ShareAlike 4.0 International,"1000 Springs Project authors, GNS Science, and University of Waikato",2026-05-27T04:53:01.284694+00:00
751,https://1000springs.org.nz/samplesite/751,/samplesite/751,Tokaanu,-38.9688,175.7624,Tokaanu Feature 37,"Known as Paurini, this large spring at the back of the walk. Looks very deep. Surrounded by lots of overhanging trees. No visible outputs.",manually saved 1000 Springs mapsearch page source,Creative Commons Attribution-NonCommercial-ShareAlike 4.0 International,"1000 Springs Project authors, GNS Science, and University of Waikato",2026-05-27T04:53:01.284714+00:00
752,https://1000springs.org.nz/samplesite/752,/samplesite/752,Tokaanu,-38.9682,175.7632,Tokaanu Feature 38,"Known as Uruhina, this pool is situated next to the old changing shed. Surrounded by reeds. Orange and green coloured sediment.",manually saved 1000 Springs mapsearch page source,Creative Commons Attribution-NonCommercial-ShareAlike 4.0 International,"1000 Springs Project authors, GNS Science, and University of Waikato",2026-05-27T04:53:01.284732+00:00
753,https://1000springs.org.nz/samplesite/753,/samplesite/753,Tokaanu,-38.9682,175.7625,Tokaanu Feature 39,Pool completely surrounded by reeds. Some trees overhang. Could be connected to a larger water body on the east side of it.,manually saved 1000 Springs mapsearch page source,Creative Commons Attribution-NonCommercial-ShareAlike 4.0 International,"1000 Springs Project authors, GNS Science, and University of Waikato",2026-05-27T04:53:01.284750+00:00
754,https://1000springs.org.nz/samplesite/754,/samplesite/754,Rotorua,-38.1642,176.2524,Te Puia Feature 10,Interesting spring with lots of separate mud pots in the middle of it. Surrounded by lots of manuka. Some black floating scum on top.,manually saved 1000 Springs mapsearch page source,Creative Commons Attribution-NonCommercial-ShareAlike 4.0 International,"1000 Springs Project authors, GNS Science, and University of Waikato",2026-05-27T04:53:01.284770+00:00
755,https://1000springs.org.nz/samplesite/755,/samplesite/755,Rotorua,-38.1642,176.2527,Te Puia Feature 11,Spring with a blue/grey tinge. Surrounded by a crust/mud bank. Has an island in the middle. No visible outputs. Vegetation half a metre back from edge.,manually saved 1000 Springs mapsearch page source,Creative Commons Attribution-NonCommercial-ShareAlike 4.0 International,"1000 Springs Project authors, GNS Science, and University of Waikato",2026-05-27T04:53:01.284791+00:00
756,https://1000springs.org.nz/samplesite/756,/samplesite/756,Rotorua,-38.1641,176.2527,Te Puia Feature 12,"Known as Ngapuna Tokotoru, this spring has very minor bubbling and brown scum floating on top. It has a green/blue tinge to it and some vegetation surrounds it on one side.",manually saved 1000 Springs mapsearch page source,Creative Commons Attribution-NonCommercial-ShareAlike 4.0 International,"1000 Springs Project authors, GNS Science, and University of Waikato",2026-05-27T04:53:01.284813+00:00
757,https://1000springs.org.nz/samplesite/757,/samplesite/757,Rotorua,-38.164,176.2522,Te Puia Feature 13,This hot spring has a major upwelling of water. Some dead branches lie at the edge. Outflows into Puarenga Steam. Lots of little springs in output.,manually saved 1000 Springs mapsearch page source,Creative Commons Attribution-NonCommercial-ShareAlike 4.0 International,"1000 Springs Project authors, GNS Science, and University of Waikato",2026-05-27T04:53:01.284841+00:00
758,https://1000springs.org.nz/samplesite/758,/samplesite/758,Rotorua,-38.164,176.2522,Te Puia Feature 14,Turbid looking pool adjacent to Feature 13. A manuka bush overhangs it and there may be a slight outflow down to Feature 13. The ebullition stirs up the sediment on the bottom of the pool.,manually saved 1000 Springs mapsearch page source,Creative Commons Attribution-NonCommercial-ShareAlike 4.0 International,"1000 Springs Project authors, GNS Science, and University of Waikato",2026-05-27T04:53:01.284865+00:00
759,https://1000springs.org.nz/samplesite/759,/samplesite/759,Rotorua,-38.1639,176.2528,Te Puia Feature 15,This spring has no immediate vegetation except for one manuka tree a metre back. Some grey scum floats on top and there are no outputs.,manually saved 1000 Springs mapsearch page source,Creative Commons Attribution-NonCommercial-ShareAlike 4.0 International,"1000 Springs Project authors, GNS Science, and University of Waikato",2026-05-27T04:53:01.284884+00:00
760,https://1000springs.org.nz/samplesite/760,/samplesite/760,Rotorua,-38.1641,176.2529,Te Puia Feature 16,Spring with a hard sinter around its edges. No vegetation surrounds it and there is a distinct hydrogen sulphide smell. Grey sediment on bottom.,manually saved 1000 Springs mapsearch page source,Creative Commons Attribution-NonCommercial-ShareAlike 4.0 International,"1000 Springs Project authors, GNS Science, and University of Waikato",2026-05-27T04:53:01.284903+00:00
761,https://1000springs.org.nz/samplesite/761,/samplesite/761,Rotorua,-38.1642,176.253,Te Puia Feature 17,Cooler spring right next to Feature 16. No surrounding vegetation and no visible outputs or connections with Feature 16.,manually saved 1000 Springs mapsearch page source,Creative Commons Attribution-NonCommercial-ShareAlike 4.0 International,"1000 Springs Project authors, GNS Science, and University of Waikato",2026-05-27T04:53:01.284920+00:00
762,https://1000springs.org.nz/samplesite/762,/samplesite/762,Rotorua,-38.1641,176.2529,Te Puia Feature 18,Tiny deep spring adjacent to Features 16 and 17. Surrounded by hard sinter and it's quite deep. The spring has coloured the sinter yellow around it. Zero vegetation or outputs.,manually saved 1000 Springs mapsearch page source,Creative Commons Attribution-NonCommercial-ShareAlike 4.0 International,"1000 Springs Project authors, GNS Science, and University of Waikato",2026-05-27T04:53:01.284944+00:00
763,https://1000springs.org.nz/samplesite/763,/samplesite/763,Rotorua,-38.1641,176.253,Te Puia Feature 19,Another tiny spring adjacent to Feature 16 but this time on the north side. No vegetation surrounding and no outputs. Some sinter surrounds it.,manually saved 1000 Springs mapsearch page source,Creative Commons Attribution-NonCommercial-ShareAlike 4.0 International,"1000 Springs Project authors, GNS Science, and University of Waikato",2026-05-27T04:53:01.284963+00:00
764,https://1000springs.org.nz/samplesite/764,/samplesite/764,Rotorua,-38.1309,176.244,Kuirau Park Feature 91,Large geothermal spring with input from culvert from Kuirau Lake and no apparent outlet. Lots of overhanding vegetation and floating bubbles in the center.,manually saved 1000 Springs mapsearch page source,Creative Commons Attribution-NonCommercial-ShareAlike 4.0 International,"1000 Springs Project authors, GNS Science, and University of Waikato",2026-05-27T04:53:01.284984+00:00
765,https://1000springs.org.nz/samplesite/765,/samplesite/765,Rotorua,-38.1309,176.2441,Kuirau Park Feature 92,Sunken spring hiding underneath manuka bushes. Clay walls with lots of bear farts growing. No visible outputs.,manually saved 1000 Springs mapsearch page source,Creative Commons Attribution-NonCommercial-ShareAlike 4.0 International,"1000 Springs Project authors, GNS Science, and University of Waikato",2026-05-27T04:53:01.285001+00:00
766,https://1000springs.org.nz/samplesite/766,/samplesite/766,Rotorua,-38.131,176.244,Kuirau Park Feature 93,Quite turbid pool immediately south of Feature 92. Lots of manuka overhang this pool and can count 10 bear farts surrounding the spring. No visible outputs.,manually saved 1000 Springs mapsearch page source,Creative Commons Attribution-NonCommercial-ShareAlike 4.0 International,"1000 Springs Project authors, GNS Science, and University of Waikato",2026-05-27T04:53:01.285022+00:00
767,https://1000springs.org.nz/samplesite/767,/samplesite/767,Rotorua,-38.1306,176.2445,Kuirau Park Feature 94,"Tiny little spring in a sinter, fenced off by itself. No immediate vegetation except for a small amount of grass. Yellow coloured tinge to rock immediately surrounding it.",manually saved 1000 Springs mapsearch page source,Creative Commons Attribution-NonCommercial-ShareAlike 4.0 International,"1000 Springs Project authors, GNS Science, and University of Waikato",2026-05-27T04:53:01.285049+00:00
768,https://1000springs.org.nz/samplesite/768,/samplesite/768,Rotorua,-38.1312,176.2416,Kuirau Park Feature 95,Deep clear spring surrounded by sinter with a single outlet flowing into a drain by the road. Some dead logs are present in the pool.,manually saved 1000 Springs mapsearch page source,Creative Commons Attribution-NonCommercial-ShareAlike 4.0 International,"1000 Springs Project authors, GNS Science, and University of Waikato",2026-05-27T04:53:01.285070+00:00
769,https://1000springs.org.nz/samplesite/769,/samplesite/769,Rotorua,-38.1312,176.2417,Kuirau Park Feature 96,Cooler spring with lots of grass surrounding it and overhanging into the pool. No visible outputs. East of Feature 95.,manually saved 1000 Springs mapsearch page source,Creative Commons Attribution-NonCommercial-ShareAlike 4.0 International,"1000 Springs Project authors, GNS Science, and University of Waikato",2026-05-27T04:53:01.285088+00:00
770,https://1000springs.org.nz/samplesite/770,/samplesite/770,Rotorua,-38.1313,176.2417,Kuirau Park Feature 97,Chloride type spring with a grey sediment around the edges. Some dead branches exist at edges also. No other immediate vegetation. Connected to Feature 98.,manually saved 1000 Springs mapsearch page source,Creative Commons Attribution-NonCommercial-ShareAlike 4.0 International,"1000 Springs Project authors, GNS Science, and University of Waikato",2026-05-27T04:53:01.285109+00:00
771,https://1000springs.org.nz/samplesite/771,/samplesite/771,Rotorua,-38.1313,176.2418,Kuirau Park Feature 98,"Clear spring surrounded by sinter, grey sediment, but no vegetation. Connected to Feature 97 but has a completely separate source.",manually saved 1000 Springs mapsearch page source,Creative Commons Attribution-NonCommercial-ShareAlike 4.0 International,"1000 Springs Project authors, GNS Science, and University of Waikato",2026-05-27T04:53:01.285127+00:00
772,https://1000springs.org.nz/samplesite/772,/samplesite/772,Rotorua,-38.1314,176.2419,Kuirau Park Feature 99,"Clear spring south of Feature 98 and not on the 1998 map. Surrounded by sinter, grey sediments, and dead tree branches.",manually saved 1000 Springs mapsearch page source,Creative Commons Attribution-NonCommercial-ShareAlike 4.0 International,"1000 Springs Project authors, GNS Science, and University of Waikato",2026-05-27T04:53:01.285145+00:00
773,https://1000springs.org.nz/samplesite/773,/samplesite/773,Rotorua,-38.1307,176.2415,Kuirau Park Feature 100,Spring that has been encased by a vertical concrete pipe. White foam floating on top. Looks very deep. No outputs or vegetation.,manually saved 1000 Springs mapsearch page source,Creative Commons Attribution-NonCommercial-ShareAlike 4.0 International,"1000 Springs Project authors, GNS Science, and University of Waikato",2026-05-27T04:53:01.285164+00:00
774,https://1000springs.org.nz/samplesite/774,/samplesite/774,Rotorua,-38.1308,176.2417,Kuirau Park Feature 101,"Spring with lots of grey sediment and wooden planks. Surrounded by grass, and the single outlet drains to the roadside.",manually saved 1000 Springs mapsearch page source,Creative Commons Attribution-NonCommercial-ShareAlike 4.0 International,"1000 Springs Project authors, GNS Science, and University of Waikato",2026-05-27T04:53:01.285182+00:00
775,https://1000springs.org.nz/samplesite/775,/samplesite/775,Rotorua,-38.1309,176.2417,Kuirau Park Feature 102,Muddy spring with two 80 C mud pots adjacent to the sampling area and no oulet. Surrounded by grass on most sides but by clay on one. Dead tree branches in the spring.,manually saved 1000 Springs mapsearch page source,Creative Commons Attribution-NonCommercial-ShareAlike 4.0 International,"1000 Springs Project authors, GNS Science, and University of Waikato",2026-05-27T04:53:01.285205+00:00
776,https://1000springs.org.nz/samplesite/776,/samplesite/776,Rotorua,-38.1311,176.2418,Kuirau Park Feature 103,Awesome spring hidden in very long grass. Surrounded by cracked mud so was probably once much larger. No outputs and lots of floating bubbles. Blue colour to it.,manually saved 1000 Springs mapsearch page source,Creative Commons Attribution-NonCommercial-ShareAlike 4.0 International,"1000 Springs Project authors, GNS Science, and University of Waikato",2026-05-27T04:53:01.285226+00:00
777,https://1000springs.org.nz/samplesite/777,/samplesite/777,Rotorua,-38.1311,176.2417,Kuirau Park Feature 104,"A small spring next to Feature 103 also hidden by high grass. Lots of different coloured biofilm (brown, orange, and green). No visible outlet but may have been connected to Feature 103 at some point..",manually saved 1000 Springs mapsearch page source,Creative Commons Attribution-NonCommercial-ShareAlike 4.0 International,"1000 Springs Project authors, GNS Science, and University of Waikato",2026-05-27T04:53:01.285252+00:00
