source_id,source_url,path,geothermal_system,latitude,longitude,name,map_description,source,source_licence,attribution,parsed_at_utc
484,https://1000springs.org.nz/samplesite/484,/samplesite/484,Waiotapu,-38.3621,176.3675,Waiotapu No.15 Feature 27,"Spring right around the side of the lake. Overhanging dead Manuka branches. Sediment around the edge has green biomass, with some red and then grey sediment. Some floating scum flowing along the surface.",manually saved 1000 Springs mapsearch page source,Creative Commons Attribution-NonCommercial-ShareAlike 4.0 International,"1000 Springs Project authors, GNS Science, and University of Waikato",2026-05-27T04:53:01.279826+00:00
485,https://1000springs.org.nz/samplesite/485,/samplesite/485,Waiotapu,-38.3619,176.3694,Waiotapu No.16 Feature 1,"Oyster Pool at Waiotapu. Very pretty spring, teal colour, surrounded by yellow sediment and a hard sinter around the edges. No vegetation.",manually saved 1000 Springs mapsearch page source,Creative Commons Attribution-NonCommercial-ShareAlike 4.0 International,"1000 Springs Project authors, GNS Science, and University of Waikato",2026-05-27T04:53:01.279845+00:00
486,https://1000springs.org.nz/samplesite/486,/samplesite/486,Waiotapu,-38.3617,176.3695,Waiotapu No.16 Feature 2,"Little spring immediately east of Oyster Pool. Light grey in colour, and much cooler in temperature than Oyster. No immediate vegetation.",manually saved 1000 Springs mapsearch page source,Creative Commons Attribution-NonCommercial-ShareAlike 4.0 International,"1000 Springs Project authors, GNS Science, and University of Waikato",2026-05-27T04:53:01.279864+00:00
487,https://1000springs.org.nz/samplesite/487,/samplesite/487,Waiotapu,-38.3617,176.3696,Waiotapu No.16 Feature 3,"Small spring north of Oyster Pool, about 3.5 metres. No visible outputs. Surrounded by yellow coloured sediment with a black rim. Some dead twigs in spring, otherwise no immediate vegetation.",manually saved 1000 Springs mapsearch page source,Creative Commons Attribution-NonCommercial-ShareAlike 4.0 International,"1000 Springs Project authors, GNS Science, and University of Waikato",2026-05-27T04:53:01.279889+00:00
488,https://1000springs.org.nz/samplesite/488,/samplesite/488,Waiotapu,-38.3626,176.369,Waiotapu No.18 Feature 1,"Yellow, murky coloured pool. Surrounded by overhanging vegetation on most sides. Has lots of dead twigs around edges. Brown floating matter on top of water. Some output into Frying Pan Stream.",manually saved 1000 Springs mapsearch page source,Creative Commons Attribution-NonCommercial-ShareAlike 4.0 International,"1000 Springs Project authors, GNS Science, and University of Waikato",2026-05-27T04:53:01.279914+00:00
489,https://1000springs.org.nz/samplesite/489,/samplesite/489,Waiotapu,-38.3629,176.3688,Waiotapu No.18 Feature 2,Lake Ngakoro Waterfall. Stream that comes from Frying Pan Flat and flows over Ngakoro Falls and into the lake at no.18. Fast flowing with a small amount of floating scum. Green with a light khaki undertone.,manually saved 1000 Springs mapsearch page source,Creative Commons Attribution-NonCommercial-ShareAlike 4.0 International,"1000 Springs Project authors, GNS Science, and University of Waikato",2026-05-27T04:53:01.279940+00:00
490,https://1000springs.org.nz/samplesite/490,/samplesite/490,Waiotapu,-38.362,176.3701,Waiotapu No.16 Feature 4,A small stream past Oyster Pool and Sulphur Cave. Lots of sandflies and dead tree branches in pool. Some green biomass floating on top in places. Water is clear and the stream bed is covered in brown sediment.,manually saved 1000 Springs mapsearch page source,Creative Commons Attribution-NonCommercial-ShareAlike 4.0 International,"1000 Springs Project authors, GNS Science, and University of Waikato",2026-05-27T04:53:01.279966+00:00
491,https://1000springs.org.nz/samplesite/491,/samplesite/491,Waiotapu,-38.3613,176.3705,Waiotapu No.20 Feature 1,"Awesome little spring found by the spectacular Karen, hiding behind a big sulphur mound. Small outflow into nearby stream. No immediate vegetation. Yellow coloured sediment.",manually saved 1000 Springs mapsearch page source,Creative Commons Attribution-NonCommercial-ShareAlike 4.0 International,"1000 Springs Project authors, GNS Science, and University of Waikato",2026-05-27T04:53:01.279988+00:00
492,https://1000springs.org.nz/samplesite/492,/samplesite/492,Waiotapu,-38.3613,176.3706,Waiotapu No.20 Feature 2,Small spring north east of Feature 1. Clear water with grey sediment on the bottom and sides. Outflow joins the adjacent stream.Dead branches in spring with no immediate vegetation.,manually saved 1000 Springs mapsearch page source,Creative Commons Attribution-NonCommercial-ShareAlike 4.0 International,"1000 Springs Project authors, GNS Science, and University of Waikato",2026-05-27T04:53:01.280011+00:00
493,https://1000springs.org.nz/samplesite/493,/samplesite/493,Waiotapu,-38.3612,176.3703,Waiotapu No.20 Feature 3,"Small spring adjacent to a stream, directly in front and to the left slightly of the lookout. Some dead twigs at bottom of spring. Clear water with brown sediment.",manually saved 1000 Springs mapsearch page source,Creative Commons Attribution-NonCommercial-ShareAlike 4.0 International,"1000 Springs Project authors, GNS Science, and University of Waikato",2026-05-27T04:53:01.280032+00:00
494,https://1000springs.org.nz/samplesite/494,/samplesite/494,Waiotapu,-38.3613,176.3702,Waiotapu No.20 Feature 4,"Stream that flows past the sulphur mounds at No.20. A wee bit murky, grey in colour with a slight green hue. Some floating bubbles. Lots of dead branches in stream.",manually saved 1000 Springs mapsearch page source,Creative Commons Attribution-NonCommercial-ShareAlike 4.0 International,"1000 Springs Project authors, GNS Science, and University of Waikato",2026-05-27T04:53:01.280054+00:00
495,https://1000springs.org.nz/samplesite/495,/samplesite/495,Tikitere,-38.0597,176.3591,Tikitere Feature 35,"Little pool between Features 34 & 36, near the mud volcano. A tiny amount of floating scum. No vegetation.",manually saved 1000 Springs mapsearch page source,Creative Commons Attribution-NonCommercial-ShareAlike 4.0 International,"1000 Springs Project authors, GNS Science, and University of Waikato",2026-05-27T04:53:01.280072+00:00
496,https://1000springs.org.nz/samplesite/496,/samplesite/496,Tikitere,-38.0597,176.3591,Tikitere Feature 36,"Medium sized spring near the mud volcano. Looks very turbid, medium grey in colour, lots of floating scum, no vegetation.",manually saved 1000 Springs mapsearch page source,Creative Commons Attribution-NonCommercial-ShareAlike 4.0 International,"1000 Springs Project authors, GNS Science, and University of Waikato",2026-05-27T04:53:01.280090+00:00
497,https://1000springs.org.nz/samplesite/497,/samplesite/497,Tikitere,-38.0597,176.359,Tikitere Feature 37,Another small spring near the mud volcano. Dark grey in colour with no vegetation. Some bubbly floating scum on top.,manually saved 1000 Springs mapsearch page source,Creative Commons Attribution-NonCommercial-ShareAlike 4.0 International,"1000 Springs Project authors, GNS Science, and University of Waikato",2026-05-27T04:53:01.280108+00:00
498,https://1000springs.org.nz/samplesite/498,/samplesite/498,Tikitere,-38.0597,176.3591,Tikitere Feature 38,One of many little hot springs near the mud volcano. Some floating bubbles. Brown/grey in colour. No vegetation.,manually saved 1000 Springs mapsearch page source,Creative Commons Attribution-NonCommercial-ShareAlike 4.0 International,"1000 Springs Project authors, GNS Science, and University of Waikato",2026-05-27T04:53:01.280125+00:00
499,https://1000springs.org.nz/samplesite/499,/samplesite/499,Tikitere,-38.0595,176.3591,Tikitere Feature 39,"Spring adjacent to the mud volcano, on the opposite side (east) than previous features. A few different sources are evident into this pool from the ebullition. Light grey in colour with no nearby vegetation.",manually saved 1000 Springs mapsearch page source,Creative Commons Attribution-NonCommercial-ShareAlike 4.0 International,"1000 Springs Project authors, GNS Science, and University of Waikato",2026-05-27T04:53:01.280150+00:00
500,https://1000springs.org.nz/samplesite/500,/samplesite/500,Tikitere,-38.0596,176.3591,Tikitere Feature 40,Little spring to the east of the mud volcano and in front of Feature 39. Hardly any bubbling with lots of stagnant floating material.,manually saved 1000 Springs mapsearch page source,Creative Commons Attribution-NonCommercial-ShareAlike 4.0 International,"1000 Springs Project authors, GNS Science, and University of Waikato",2026-05-27T04:53:01.280170+00:00
501,https://1000springs.org.nz/samplesite/501,/samplesite/501,Tikitere,-38.0595,176.3591,Tikitere Feature 41,Large lake in front of the mud volcano. Medium grey in colour and lots of floating scum. Sample taken east of mud volcano. No vegetation whatsoever on any side.,manually saved 1000 Springs mapsearch page source,Creative Commons Attribution-NonCommercial-ShareAlike 4.0 International,"1000 Springs Project authors, GNS Science, and University of Waikato",2026-05-27T04:53:01.280192+00:00
502,https://1000springs.org.nz/samplesite/502,/samplesite/502,Tikitere,-38.0593,176.359,Tikitere Feature 42,"Little brown spring next to the lake of Feature 41. Much hotter than all springs nearby, it has no floating scum or vegetation.",manually saved 1000 Springs mapsearch page source,Creative Commons Attribution-NonCommercial-ShareAlike 4.0 International,"1000 Springs Project authors, GNS Science, and University of Waikato",2026-05-27T04:53:01.280210+00:00
503,https://1000springs.org.nz/samplesite/503,/samplesite/503,Tikitere,-38.0593,176.359,Tikitere Feature 43,Super hot spring east of mud volcano and Feature 42. Very brown in colour with lots of gas discharge. Zero vegetation.,manually saved 1000 Springs mapsearch page source,Creative Commons Attribution-NonCommercial-ShareAlike 4.0 International,"1000 Springs Project authors, GNS Science, and University of Waikato",2026-05-27T04:53:01.280228+00:00
504,https://1000springs.org.nz/samplesite/504,/samplesite/504,Rotorua,-38.132,176.2437,Kuirau Park Feature 12,"Large spring/pond near Kuirau Street. Surrounded by vegetation with lots of eukaryotes, including a Pukeho. Some floating scum on top.",manually saved 1000 Springs mapsearch page source,Creative Commons Attribution-NonCommercial-ShareAlike 4.0 International,"1000 Springs Project authors, GNS Science, and University of Waikato",2026-05-27T04:53:01.280247+00:00
505,https://1000springs.org.nz/samplesite/505,/samplesite/505,Rotorua,-38.1321,176.2439,Kuirau Park Feature 13,Stagnant looking pool with lots of floating scum. Trees overhang it. Looks very muddy.,manually saved 1000 Springs mapsearch page source,Creative Commons Attribution-NonCommercial-ShareAlike 4.0 International,"1000 Springs Project authors, GNS Science, and University of Waikato",2026-05-27T04:53:01.280262+00:00
506,https://1000springs.org.nz/samplesite/506,/samplesite/506,Rotorua,-38.1321,176.2439,Kuirau Park Feature 14,"Very muddy hot pool, not connected to Feature 13. Bubbling away with heaps of brown floating scum. Much more active than Feature 13. Surrounded by vegetation.",manually saved 1000 Springs mapsearch page source,Creative Commons Attribution-NonCommercial-ShareAlike 4.0 International,"1000 Springs Project authors, GNS Science, and University of Waikato",2026-05-27T04:53:01.280284+00:00
507,https://1000springs.org.nz/samplesite/507,/samplesite/507,Rotorua,-38.132,176.2439,Kuirau Park Feature 15,"Little spring slightly north of Features 13 & 14. Super hot, lots of steam. Dead branches in it, otherwise no immediate vegetation.",manually saved 1000 Springs mapsearch page source,Creative Commons Attribution-NonCommercial-ShareAlike 4.0 International,"1000 Springs Project authors, GNS Science, and University of Waikato",2026-05-27T04:53:01.280303+00:00
508,https://1000springs.org.nz/samplesite/508,/samplesite/508,Rotorua,-38.1326,176.2449,Kuirau Park Feature 16,"Large pool, khaki green in colour with lots of white floating material. Surrounded by trees.",manually saved 1000 Springs mapsearch page source,Creative Commons Attribution-NonCommercial-ShareAlike 4.0 International,"1000 Springs Project authors, GNS Science, and University of Waikato",2026-05-27T04:53:01.280320+00:00
509,https://1000springs.org.nz/samplesite/509,/samplesite/509,Rotorua,-38.1328,176.2443,Kuirau Park Feature 17,Medium sized spring with a pukeho nest on it's borders. Pale green/yellow in colour. Surrounded by vegetation.,manually saved 1000 Springs mapsearch page source,Creative Commons Attribution-NonCommercial-ShareAlike 4.0 International,"1000 Springs Project authors, GNS Science, and University of Waikato",2026-05-27T04:53:01.280338+00:00
510,https://1000springs.org.nz/samplesite/510,/samplesite/510,Rotorua,-38.1326,176.2443,Kuirau Park Feature 18,Little hidden spring next to Feature 16. Some steam is visible and blue/green in colour. Surrounded by lots of trees.,manually saved 1000 Springs mapsearch page source,Creative Commons Attribution-NonCommercial-ShareAlike 4.0 International,"1000 Springs Project authors, GNS Science, and University of Waikato",2026-05-27T04:53:01.280356+00:00
511,https://1000springs.org.nz/samplesite/511,/samplesite/511,Rotorua,-38.1327,176.2442,Kuirau Park Feature 19,Tiny little spring hidden near Feature 18. Very deep (2m) hole with some vegetation around outside.Water is pretty clear with lots of dead branches in it.,manually saved 1000 Springs mapsearch page source,Creative Commons Attribution-NonCommercial-ShareAlike 4.0 International,"1000 Springs Project authors, GNS Science, and University of Waikato",2026-05-27T04:53:01.280378+00:00
512,https://1000springs.org.nz/samplesite/512,/samplesite/512,Tikitere,-38.0594,176.3592,Tikitere Feature 44,Awesome little spring near the mud volcano section of the site. No surrounding vegetation and lots of black and yellow precipitate around sides. Dark grey and happily bubbling away.,manually saved 1000 Springs mapsearch page source,Creative Commons Attribution-NonCommercial-ShareAlike 4.0 International,"1000 Springs Project authors, GNS Science, and University of Waikato",2026-05-27T04:53:01.280400+00:00
513,https://1000springs.org.nz/samplesite/513,/samplesite/513,Tikitere,-38.0593,176.3591,Tikitere Feature 45,Small spring near Feature 44. Dark grey in colour with a hint of brown. A dead branch exists at the side of the spring. No other vegetation.,manually saved 1000 Springs mapsearch page source,Creative Commons Attribution-NonCommercial-ShareAlike 4.0 International,"1000 Springs Project authors, GNS Science, and University of Waikato",2026-05-27T04:53:01.280420+00:00
514,https://1000springs.org.nz/samplesite/514,/samplesite/514,Tikitere,-38.0593,176.3591,Tikitere Feature 46,Tiny spring east of Feature 45. Also with a dead branch in it. No other vegetation. Surrounded by black precipitate and pebbles.,manually saved 1000 Springs mapsearch page source,Creative Commons Attribution-NonCommercial-ShareAlike 4.0 International,"1000 Springs Project authors, GNS Science, and University of Waikato",2026-05-27T04:53:01.280439+00:00
515,https://1000springs.org.nz/samplesite/515,/samplesite/515,Tikitere,-38.0593,176.3591,Tikitere Feature 47,"Little spring by itself, east of Features 45 and 46. Clear ish water with a hint of grey in colour. No immediate vegetation.",manually saved 1000 Springs mapsearch page source,Creative Commons Attribution-NonCommercial-ShareAlike 4.0 International,"1000 Springs Project authors, GNS Science, and University of Waikato",2026-05-27T04:53:01.280457+00:00
516,https://1000springs.org.nz/samplesite/516,/samplesite/516,Tikitere,-38.0592,176.3592,Tikitere Feature 48,Large pool next to the previous four features. No surrounding vegetation. Yellow precipitate around edges. Moderate outflow into nearby lake.,manually saved 1000 Springs mapsearch page source,Creative Commons Attribution-NonCommercial-ShareAlike 4.0 International,"1000 Springs Project authors, GNS Science, and University of Waikato",2026-05-27T04:53:01.280476+00:00
517,https://1000springs.org.nz/samplesite/517,/samplesite/517,Tikitere,-38.0592,176.3591,Tikitere Feature 49,"Large spring right next to path between the mud volcano and the steaming cliffs. Zero vegetation. Surrounded by rocks and pebbles, white and yellow in colour.",manually saved 1000 Springs mapsearch page source,Creative Commons Attribution-NonCommercial-ShareAlike 4.0 International,"1000 Springs Project authors, GNS Science, and University of Waikato",2026-05-27T04:53:01.280497+00:00
518,https://1000springs.org.nz/samplesite/518,/samplesite/518,Tikitere,-38.059,176.359,Tikitere Feature 50,Medium sized pool surrounded by grey sediment and no vegetation. Medium grey in colour with some floating particulates. A small geothermal stream flows into this pool.,manually saved 1000 Springs mapsearch page source,Creative Commons Attribution-NonCommercial-ShareAlike 4.0 International,"1000 Springs Project authors, GNS Science, and University of Waikato",2026-05-27T04:53:01.280520+00:00
519,https://1000springs.org.nz/samplesite/519,/samplesite/519,Tikitere,-38.059,176.359,Tikitere Feature 51,Small pool adjacent to Feature 50. Lots of gas discharge with bubbles floating on the surface.No vegetation and slight outflow into Feature 50.,manually saved 1000 Springs mapsearch page source,Creative Commons Attribution-NonCommercial-ShareAlike 4.0 International,"1000 Springs Project authors, GNS Science, and University of Waikato",2026-05-27T04:53:01.280540+00:00
520,https://1000springs.org.nz/samplesite/520,/samplesite/520,Rotorua,-38.1335,176.2447,Kuirau Park Feature 20,Very muddy pool adjacent to Kuirau Street through the park. Lots of vegetation surrounding it. Some brown floating scum on top.,manually saved 1000 Springs mapsearch page source,Creative Commons Attribution-NonCommercial-ShareAlike 4.0 International,"1000 Springs Project authors, GNS Science, and University of Waikato",2026-05-27T04:53:01.280559+00:00
521,https://1000springs.org.nz/samplesite/521,/samplesite/521,Rotorua,-38.1336,176.2447,Kuirau Park Feature 21,Larger muddy pool hidden behind Feature 20. Lots of dead trees overhang it and it has lots of gas discharge. Some floating white sediment.,manually saved 1000 Springs mapsearch page source,Creative Commons Attribution-NonCommercial-ShareAlike 4.0 International,"1000 Springs Project authors, GNS Science, and University of Waikato",2026-05-27T04:53:01.280578+00:00
522,https://1000springs.org.nz/samplesite/522,/samplesite/522,Rotorua,-38.1336,176.245,Kuirau Park Feature 22,Decent sized spring east of Kuirau Street. Home to Pukeko's. Snot green in colour and surrounded by trees.,manually saved 1000 Springs mapsearch page source,Creative Commons Attribution-NonCommercial-ShareAlike 4.0 International,"1000 Springs Project authors, GNS Science, and University of Waikato",2026-05-27T04:53:01.280597+00:00
523,https://1000springs.org.nz/samplesite/523,/samplesite/523,Rotorua,-38.1333,176.2448,Kuirau Park Feature 23,Similar looking pool to Feature 22. Snot green colour but lots of bubbling gas discharge. Surrounded by trees.,manually saved 1000 Springs mapsearch page source,Creative Commons Attribution-NonCommercial-ShareAlike 4.0 International,"1000 Springs Project authors, GNS Science, and University of Waikato",2026-05-27T04:53:01.280614+00:00
524,https://1000springs.org.nz/samplesite/524,/samplesite/524,Rotorua,-38.1331,176.2454,Kuirau Park Feature 24,Little spring adjacent to road. Clear in colour with brown sediment on the bottom. A couple of shrubs lie next to it. There's also a black line around the edge.,manually saved 1000 Springs mapsearch page source,Creative Commons Attribution-NonCommercial-ShareAlike 4.0 International,"1000 Springs Project authors, GNS Science, and University of Waikato",2026-05-27T04:53:01.280637+00:00
525,https://1000springs.org.nz/samplesite/525,/samplesite/525,Rotorua,-38.1331,176.2454,Kuirau Park Feature 25,Clear spring with lots of dead trees and branches in it. Surrounded by woody vegetation on all sides. Looks very deep.,manually saved 1000 Springs mapsearch page source,Creative Commons Attribution-NonCommercial-ShareAlike 4.0 International,"1000 Springs Project authors, GNS Science, and University of Waikato",2026-05-27T04:53:01.280656+00:00
526,https://1000springs.org.nz/samplesite/526,/samplesite/526,Rotorua,-38.1334,176.2455,Kuirau Park Feature 26,Decent sized spring next to the man made pool. It has lots of floating leaves and green biomass around edges. Clear with brown and green sediment. It has inflow from a nearly spring (Feature 28).,manually saved 1000 Springs mapsearch page source,Creative Commons Attribution-NonCommercial-ShareAlike 4.0 International,"1000 Springs Project authors, GNS Science, and University of Waikato",2026-05-27T04:53:01.280681+00:00
527,https://1000springs.org.nz/samplesite/527,/samplesite/527,Rotorua,-38.1335,176.2454,Kuirau Park Feature 27,Green coloured spring in the shape of a whale. Lots of floating vegetation. Surrounded by trees.,manually saved 1000 Springs mapsearch page source,Creative Commons Attribution-NonCommercial-ShareAlike 4.0 International,"1000 Springs Project authors, GNS Science, and University of Waikato",2026-05-27T04:53:01.280704+00:00
528,https://1000springs.org.nz/samplesite/528,/samplesite/528,Rotorua,-38.1335,176.2459,Kuirau Park Feature 28,"Clear, deep spring with some floating leaves. Some trees overhang it and it's very calm with lots of steam.",manually saved 1000 Springs mapsearch page source,Creative Commons Attribution-NonCommercial-ShareAlike 4.0 International,"1000 Springs Project authors, GNS Science, and University of Waikato",2026-05-27T04:53:01.280723+00:00
529,https://1000springs.org.nz/samplesite/529,/samplesite/529,Rotorua,-38.1336,176.2452,Kuirau Park Feature 29,The whale's tail. The whale being Feature 27. Looks like they were once connected but not anymore. Vivid green in colour. Surrounded by vegetation.,manually saved 1000 Springs mapsearch page source,Creative Commons Attribution-NonCommercial-ShareAlike 4.0 International,"1000 Springs Project authors, GNS Science, and University of Waikato",2026-05-27T04:53:01.280746+00:00
530,https://1000springs.org.nz/samplesite/530,/samplesite/530,Rotorua,-38.1337,176.2458,Kuirau Park Feature 30,"Small cooler spring adjacent to Feature 29. It sits just in front of the foot baths. Surrounded by vegetation, it has lots of floating organic matter and is very turbid green in colour.",manually saved 1000 Springs mapsearch page source,Creative Commons Attribution-NonCommercial-ShareAlike 4.0 International,"1000 Springs Project authors, GNS Science, and University of Waikato",2026-05-27T04:53:01.280770+00:00
531,https://1000springs.org.nz/samplesite/531,/samplesite/531,Rotorua,-38.1337,176.2458,Kuirau Park Feature 31,Beautiful clear spring next to the foot baths. Surrounded by a sinter first and then vegetation. Lots of dead vegetation in pool plus a PVC pipe! Super deep too. Very clear.,manually saved 1000 Springs mapsearch page source,Creative Commons Attribution-NonCommercial-ShareAlike 4.0 International,"1000 Springs Project authors, GNS Science, and University of Waikato",2026-05-27T04:53:01.280793+00:00
532,https://1000springs.org.nz/samplesite/532,/samplesite/532,Rotorua,-38.1339,176.2458,Kuirau Park Feature 32,"Very murky pool, with lots of vegetation and dead matter around it and in it. Ebullition is very intermittent.",manually saved 1000 Springs mapsearch page source,Creative Commons Attribution-NonCommercial-ShareAlike 4.0 International,"1000 Springs Project authors, GNS Science, and University of Waikato",2026-05-27T04:53:01.280810+00:00
533,https://1000springs.org.nz/samplesite/533,/samplesite/533,Rotorua,-38.1339,176.2457,Kuirau Park Feature 33,Pool hidden behind foot bath. Surrounded by vegetation and has a milky aqua colour to it. A build up of green biofilm in the middle. Foot bath drains into it.,manually saved 1000 Springs mapsearch page source,Creative Commons Attribution-NonCommercial-ShareAlike 4.0 International,"1000 Springs Project authors, GNS Science, and University of Waikato",2026-05-27T04:53:01.280832+00:00
534,https://1000springs.org.nz/samplesite/534,/samplesite/534,Rotorua,-38.1337,176.246,Kuirau Park Feature 34,Muddy pool enclosed by vegetation and lots of ferns. Medium grey in colour.,manually saved 1000 Springs mapsearch page source,Creative Commons Attribution-NonCommercial-ShareAlike 4.0 International,"1000 Springs Project authors, GNS Science, and University of Waikato",2026-05-27T04:53:01.280847+00:00
535,https://1000springs.org.nz/samplesite/535,/samplesite/535,Rotorua,-38.1338,176.2464,Kuirau Park Feature 35,Clear spring close to Ranolf Street. One bush sits next to it and the pool itself has lots of dead branches. No gas discharge.,manually saved 1000 Springs mapsearch page source,Creative Commons Attribution-NonCommercial-ShareAlike 4.0 International,"1000 Springs Project authors, GNS Science, and University of Waikato",2026-05-27T04:53:01.280866+00:00
536,https://1000springs.org.nz/samplesite/536,/samplesite/536,Rotorua,-38.1344,176.2456,Kuirau Park Feature 36,Timaru Lake. Light green in colour and looks quite murky. Lots of vegetation and Pukekos surround it. Lots of individual springs bubbling up from inside the lake in separate sections.,manually saved 1000 Springs mapsearch page source,Creative Commons Attribution-NonCommercial-ShareAlike 4.0 International,"1000 Springs Project authors, GNS Science, and University of Waikato",2026-05-27T04:53:01.280889+00:00
